Ticker,title,Date,news_sentiment_score,positive_keywords_count
AAPL,Apple's new iPhone 17 is available. Will users upgrade devices?,2025-09-19 14:28:10+00:00,0.0,0
AAPL,Apple (AAPL) Sees High Demand for Affordable iPhone 17,2025-09-26 04:07:06+00:00,1.0,0
AAPL,"Inflation watch, Apple event, S&P 500 rebalancing: 3 Things",2025-09-08 13:15:10+00:00,0.0,0
AAPL,Intel 'needs' Apple to invest like Nvidia & US government did,2025-09-25 19:30:00+00:00,0.0,0
AAPL,"Nvidia CEO Jensen Huang Says 'You Can’t Overstate the Magic' That is Taiwan Semiconductor, But is TSM Stock a Buy at New Highs?",2025-09-18 19:02:02+00:00,0.8832454681396484,0
AAPL,Apple's New iPhone 17 Lineup Has Wall Street Already Looking to Next Year,2025-09-13 09:00:00+00:00,0.0,0
AAPL,Jim Cramer drops shock call on Magnificent 7 stocks,2025-09-16 20:07:00+00:00,0.0,0
AAPL,Jim Cramer Gushes About Apple Inc. (AAPL)’s iPhone Air,2025-09-16 10:46:36+00:00,0.0,0
AAPL,Here’s What Impacted Apple (AAPL) in Q2,2025-09-23 13:05:43+00:00,0.0,0
AAPL,"Apple announces Hebbal store opens Tuesday, September 2",2025-09-02 12:45:18+00:00,0.0,0
AAPL,"Carrier Incentives Could Spike Apple iPhone 17 Sales, Says Analyst",2025-09-26 17:40:01+00:00,0.0,0
AAPL,Can Apple (AAPL) Stock Impress Investors After iPhone 17 Launch?,2025-09-09 21:25:42+00:00,-0.9833018183708191,0
AAPL,Here’s Why Apple (AAPL) Traded Lower in Q2,2025-09-10 14:02:23+00:00,-0.9990372657775879,0
AAPL,Apple's Big Event on September 9 Could Be a 'Game Changer' for AAPL Stock,2025-09-05 16:37:52+00:00,0.0,0
AAPL,Apple Stock (AAPL) Backed by Analysts Ahead of iPhone Launch Event,2025-09-04 22:56:41+00:00,0.0,0
AAPL,"UBS Reiterates Neutral on Apple (AAPL), Sees Mixed iPhone 17 Preorder Demand",2025-09-22 21:39:30+00:00,-0.994056224822998,0
AAPL,Analyst Says He ‘Loves’ Apple (AAPL) Amid ‘Good News’ Following iPhone 17 Launch,2025-09-23 12:32:44+00:00,0.9999707937240601,0
AAPL,Jim Cramer Says Apple Inc. (AAPL)’s Going To Have The Best AI,2025-09-17 17:15:06+00:00,0.9999945163726807,0
AAPL,Why Analysts Believe Apple’s (AAPL) iPhone Super Cycle Is Just Beginning,2025-09-12 21:59:45+00:00,0.0,0
AAPL,"iPhone 17 Won’t Bring ‘Super Cycle’ for Apple (AAPL), AT&T CEO Says",2025-09-17 14:11:28+00:00,0.0,0
AAPL,UBS Reaffirms Price Target on Apple (AAPL) After Mixed iPhone 17 Preorder Data,2025-09-24 12:45:45+00:00,0.0,0
AAPL,Kevin O’Leary is furious at Trump ‘force-feeding’ him Intel — as the US aims to invest taxpayer money in another company,2025-09-26 21:15:00+00:00,0.0,0
AAPL,Apple (AAPL) Downgraded as Analysts See No Significant AI Innovation,2025-09-17 15:40:33+00:00,-0.9998762607574463,0
AAPL,Jim Cramer Says He’s Already Ordered His Apple (AAPL) iPhone,2025-09-14 21:38:20+00:00,0.0,0
AAPL,Today in Apple history: Apple stock smashes through $700 barrier,2025-09-17 14:48:43+00:00,0.0,0
AAPL,Analyst Explains Why Apple (AAPL) Will Struggle to Maintain Its Customer Base – ‘They’ve Gone On The Defense’,2025-09-25 14:09:09+00:00,-0.9999994039535522,0
AAPL,Why TD Cowen Stays Bullish on Apple (AAPL) Stock at $275 PT,2025-09-08 04:03:45+00:00,0.9999997615814209,0
AAPL,Why Analysts See More Upside for Apple (AAPL) After DOJ-Google Ruling,2025-09-06 10:21:40+00:00,0.9999985694885254,0
AAPL,Insider Alert: Apple (AAPL) Board Chair Offloads $20 Million in Stock,2025-09-05 18:25:35+00:00,0.0,0
AAPL,Apple (AAPL) Stock Target Raised to $310 on Surging iPhone 17 Demand,2025-09-23 03:45:53+00:00,1.0,0
AAPL,"Apple (AAPL) iPhone 17 Launch Spurs Buy Rating, $275 Price Target",2025-09-17 03:43:57+00:00,1.0,0
AAPL,Apple Stock (AAPL) Backed by Bernstein as ‘Gateway to the Intelligence Revolution’,2025-09-20 08:09:39+00:00,0.0,0
AAPL,Apple (AAPL) Stock Outlook: Analysts See Upside With New iPhone 17 Launch,2025-09-18 09:38:15+00:00,1.0,0
AAPL,"Apple (AAPL) Stock: UBS Reiterates Neutral, $220 PT on iPhone 17 Availability Data",2025-09-26 23:28:24+00:00,0.0,0
AAPL,Jim Cramer Says “Apple Remains a Maligned Company”,2025-09-10 04:10:22+00:00,0.0,0
AAPL,Big Tech stocks hold steady after Trump visa fees crackdown,2025-09-22 06:33:24+00:00,0.9804663062095642,0
AAPL,"GOOGL Stock Vs. AMZN, MSFT & META",2025-09-16 13:57:10+00:00,0.0,0
AAPL,Jim Cramer Notes Apple Averages 13% Gain a Year,2025-09-13 13:53:31+00:00,0.0,0
AAPL,"Stock market today: Dow, S&P 500, Nasdaq drift as Wall Street braces for revision to jobs data",2025-09-08 23:29:14+00:00,0.0,0
AAPL,Rosenblatt Lifts PT on Apple (AAPL) Stock,2025-09-12 10:50:36+00:00,0.8861501812934875,0
AAPL,This Analyst Was Right About Apple (AAPL),2025-09-19 13:54:00+00:00,0.0,0
AAPL,"It’s Not Just Bad Apples: Wall Street Sentiment on AAPL Stock Falls to Multi-Year Lows, so Should You Sell Shares Here?",2025-09-17 19:17:29+00:00,-0.9829156398773193,0
AAPL,"Apple Inc. (AAPL): China’s The “Wildcard,” Says Jim Cramer",2025-09-05 14:08:33+00:00,0.0,0
AAPL,Bank of America Ups AAPL Price Target to $260 in Wake of Google Search Ruling,2025-09-03 22:01:34+00:00,0.0,0
AAPL,Jim Cramer Picks Apple as the Quarterback of His Fantasy Stock Portfolio,2025-09-10 04:10:28+00:00,0.0,0
AAPL,"Top Stock Movers Now: Apple, FedEx, Lennar, and More",2025-09-19 17:02:52+00:00,0.0,0
AAPL,Google Gets to Keep Chrome. Should You Buy the Pop in GOOGL Stock?,2025-09-03 19:29:41+00:00,0.0,0
AAPL,"Stock market today: Dow, S&P 500, Nasdaq fall amid sharp GDP expansion, jobless claims dip",2025-09-24 23:47:37+00:00,0.0,0
AAPL,Jim Cramer Gushes About Apple Inc. (AAPL)’s iPhone Air,2025-09-16 10:30:09+00:00,0.0,0
AAPL,J.P. Morgan Maintains a Buy on Apple Inc (AAPL),2025-09-17 18:18:39+00:00,0.0,0
AAPL,"HSBC Keeps Hold on Apple (AAPL), Sets $220 Price Target",2025-09-14 00:10:49+00:00,0.0,0
AAPL,This Apple Insider Is Ditching AAPL Stock. Should You?,2025-09-22 17:21:34+00:00,0.0,0
AAPL,"How ‘Bout Them Apples? As AAPL Stock Flies, This Option Strategy Can Help You Squeeze Out Even More Juice.",2025-09-24 20:23:26+00:00,0.663845419883728,0
AAPL,Today in Apple history: Steve Jobs prepares to take on Apple,2025-09-02 15:55:16+00:00,0.0,0
AAPL,Today in Apple history: Steve Jobs leaves and rejoins Apple,2025-09-16 15:59:22+00:00,0.0,0
AAPL,Investors cheer Apple’s higher iPhone prices,2025-09-18 14:04:55+00:00,0.5229690074920654,0
AAPL,macOS 26 Tahoeインストーラーのダウンロードに対応した「Mist v0.30」がリリース。,2025-09-25 19:58:34+00:00,0.0,0
AAPL,"Stock market today: Dow, S&P 500, Nasdaq nudge up as Wall Street braces for revision to jobs data",2025-09-09 13:36:38+00:00,0.0,0
AAPL,"Stock market today: Dow, S&P 500, Nasdaq futures fall after back-to-back losses, jobless claims dip",2025-09-24 23:47:37+00:00,-0.6040385365486145,0
AAPL,Wedbush Just Added These Two Tech Stocks to Its 'Best Ideas' List,2025-09-15 20:03:12+00:00,0.0,0
AAPL,"Stock market today: Nasdaq, S&P 500 futures rise after Google is spared in antitrust ruling, with jobs data on deck",2025-09-02 23:18:22+00:00,0.0,0
AAPL,Low Expectations for Apple’s iPhone 17 Could Be Helping Boost the Stock. Here’s Why,2025-09-22 17:38:49+00:00,0.9999997615814209,0
AAPL,"Stock market today: Dow Jones, S&P 500, Nasdaq futures rise after landmark antitrust ruling allows Google to keep Chrome",2025-09-02 23:18:22+00:00,0.0,0
AAPL,Apple Watch (AAPL) Blood Oxygen Feature Reintroduced in US After Legal Battle,2025-09-04 19:03:38+00:00,0.0,0
AAPL,"Top Stock Movers Now: Oracle, GameStop, Synopsys, and More",2025-09-10 17:29:17+00:00,0.0,0
AAPL,"AI startup Modular raises $250 million, seeks to challenge Nvidia dominance",2025-09-24 16:09:43+00:00,-0.9999535083770752,0
AAPL,Stock Market Today: Stocks rise after worse-than-expected payroll revisions,2025-09-09 15:11:33+00:00,0.8772833347320557,0
AAPL,BofA’s Hartnett Says Magnificent 7 Stock Bubble Is Still Growing,2025-09-19 10:08:33+00:00,-0.6367033123970032,0
AAPL,Apple Stock Slips as Huawei Drops Trifold Phone Ahead of iPhone 17,2025-09-05 16:00:04+00:00,-0.9999908208847046,0
AAPL,Apple Price Target Raised to Street High on iPhone 17 Surge,2025-09-22 17:29:25+00:00,0.9999959468841553,0
AAPL,"AmazonスマイルSALEで、巻取り式USB-Cケーブル内臓のUSB電源タップ「Anker Nano Charging Station (7-in-1)」や「Anker Nano Charger (70W, 3 Ports)」などが初セール中。",2025-09-01 10:25:49+00:00,0.0,0
AAPL,Apple Silicon Macに対応した「Cyberpunk 2077: Ultimate」がMac App Storeで20%OFFセール中。,2025-09-07 23:46:56+00:00,0.0,0
AAPL,"Stock market today: Dow, S&P 500, Nasdaq edge up after US jobs data is revised sharply down",2025-09-09 13:36:38+00:00,0.0,0
AAPL,"米Anker、最大140Wでデバイスを充電しつつDisplayLinkチップによる8K/4K/4Kのトリプルディスプレイ出力が可能なドック「Anker Prime Docking Station (14-in-1, Triple Display, DisplayLink)」を発表。",2025-09-04 18:49:02+00:00,0.0,0
AAPL,Oppenheimer Reiterates Apple (AAPL) as “Perform” Despite Meta’s Smart Glasses Launch,2025-09-21 09:00:44+00:00,0.0,0
AAPL,macOS 26 TahoeやWindows 11 25H2をサポートするParallels Desktop 26のHotfix「Parallels Desktop 26 for Mac v26.0.1」がリリース。,2025-09-02 21:25:58+00:00,0.0,0
AAPL,"米Anker、アクティブクーリングシステムを搭載しQi2 25Wワイヤレス充電やアプリにも対応した「Anker Prime Wireless Charging Station (3-in-1, MagGo, AirCool, Dock Stand)」を発表。",2025-09-04 20:45:31+00:00,0.0,0
AAPL,Apple、開発者向けに「macOS 26 Tahoe」や「iOS/iPadOS 26」、「visionOS 26」のBeta 9を公開。,2025-09-02 19:16:36+00:00,0.0,0
AAPL,"Apple Inc. (AAPL): “Own It, Don’t Trade It,” Maintains Jim Cramer",2025-09-12 19:06:50+00:00,0.0,0
AAPL,"‘Unimpressed’: D.A. Davidson Downgrades Apple Inc. (AAPL) To Neutral, Maintains Price Target of $250",2025-09-18 15:22:14+00:00,-0.9985378980636597,0
AAPL,Columbia Threadneedle Global Technology Growth Strategy: Apple (AAPL) Faced a Classic Innovator’s Dilemma,2025-09-23 13:39:28+00:00,0.0,0
AAPL,Tigress Financial Partners Raises Its Price Target on Apple Inc. (AAPL) to $305,2025-09-22 22:06:04+00:00,0.9983429908752441,0
AAPL,Apple (AAPL) Stock Target Lifted to $280 as Analysts See Upside in iPhone 17 Cycle,2025-09-26 00:07:20+00:00,1.0,0
AAPL,"Anker Japan、巻取り式USB-Cケーブル搭載のモバイルバッテリー「Anker Nano Power Bank (10000mAh,45W,巻取り式USB-Cケーブル)」を発売。",2025-09-10 05:57:29+00:00,0.0,0
AAPL,Apple、開発者やデザイナー向けに新たに発売される「iPhone 17/Air/Pro」や「Apple Watch Ultra 3」、「Apple Watch Series 11」のベゼルテンプレートをPhotoshopとPNG形式で公開。,2025-09-12 23:46:57+00:00,0.0,0
AAPL,WindowsとLinux仮想マシンとの互換性を向上させた「Parallels Desktop 26 for Mac v26.1.0」がリリース。,2025-09-26 07:14:17+00:00,0.0,0
AAPL,"As Apple Unveils the iPhone 17 Lineup, Should You Buy, Sell, or Hold AAPL Stock?",2025-09-12 15:53:02+00:00,0.0,0
AAPL,Here’s How Apple (AAPL) Contributed to Macquarie Core Equity Fund’s Performance,2025-09-19 12:25:55+00:00,0.0,0
AAPL,Google、Chromeブラウザに続き「Google Drive for Desktop」クライアントでもmacOS 11 Big Surのサポートを終了。,2025-09-08 19:33:08+00:00,0.0,0
AAPL,Logitech、Logi LightChargeテクノロジーによるソーラー充電で駆動するフルサイズキーボード「Signature Slim Solar+ for Mac K980」を発売。,2025-09-24 08:32:06+00:00,0.0,0
AAPL,Apple、macOS 26 Tahoeに対応したUI KitテンプレートやSF Symbols、Icon Composerをマイナーアップデート。,2025-09-27 04:14:52+00:00,0.0,0
AAPL,OWC、Thunderbolt 5ポートを3つと10GbEポートを2基、2.5GbEを1基備えたThunderbolt 5ドック「OWC Thunderbolt 5 Dual 10GbE Network Dock」を発売。,2025-09-14 08:04:07+00:00,0.0,0
AAPL,"Stock market today: Dow, S&P 500, Nasdaq fall after back-to-back losses, jobless claims dip",2025-09-24 23:47:37+00:00,0.0,0
AAPL,"Apple initiated, Hershey upgraded: Wall Street's top analyst calls",2025-09-16 13:35:34+00:00,0.0,0
AAPL,Wearable Devices Stock Explodes As Financing Round And Gesture Control Patent Fuel Hype,2025-09-11 16:50:55+00:00,0.0,0
AAPL,"Stock market today: Dow, S&P 500, Nasdaq slide for 3rd day as Wall Street slump continues",2025-09-25 20:00:14+00:00,0.0,0
AAPL,Why JPMorgan is warning the Fed rate cut everyone expects could sink stocks,2025-09-09 14:10:00+00:00,-0.9916250109672546,0
AAPL,5 Things to Know Before the Stock Market Opens,2025-09-17 12:12:38+00:00,0.0,0
AAPL,"S&P 500 Gains & Losses Today: CarMax Stock Skids, Oracle Retreats; Intel Pushes Higher",2025-09-25 20:55:05+00:00,-0.5560513138771057,0
AAPL,"Apple downgraded, Nvidia upgraded: Wall Street's top analyst calls",2025-09-11 13:47:36+00:00,0.0,0
NVDA,China's Nvidia ban marks 'experimental phase' of trade talks,2025-09-17 21:30:00+00:00,0.0,0
NVDA,How to trade the AI boom beyond chips,2025-09-22 21:36:01+00:00,0.0,0
NVDA,Intel 'needs' Apple to invest like Nvidia & US government did,2025-09-25 19:30:00+00:00,0.0,0
NVDA,Watch for this signal in Nvidia stock to capitalize on spring-loaded gains ahead,2025-09-03 12:40:55+00:00,0.9998955726623535,0
NVDA,Buy 5 Big Data Behemoths to Benefit From Enormous Market Opportunity,2025-09-15 11:18:00+00:00,1.0,0
NVDA,Nvidia Just Invested in this Quantum Computing Stock,2025-09-04 17:32:00+00:00,0.0,0
NVDA,Nebius Shares Surge on $17.4 Billion AI Infrastructure Deal With Microsoft,2025-09-09 14:51:36+00:00,0.999996542930603,0
NVDA,"Nvidia CEO Jensen Huang Says 'You Can’t Overstate the Magic' That is Taiwan Semiconductor, But is TSM Stock a Buy at New Highs?",2025-09-18 19:02:02+00:00,0.8832454681396484,0
NVDA,Plug Power Just Reported Record Output. Should You Buy PLUG Stock Here?,2025-09-23 18:54:38+00:00,0.9999984502792358,0
NVDA,AMD Gains Traction in AI Infrastructure Market: A Sign of More Upside?,2025-09-25 16:40:00+00:00,1.0,0
NVDA,AVGO Stock vs. NVDA & INTC,2025-09-16 13:39:10+00:00,0.0,0
NVDA,China Targets Nvidia (NVDA),2025-09-18 05:09:33+00:00,0.0,0
NVDA,Nvidia's new investment is a game-changer for quantum stocks,2025-09-06 02:03:00+00:00,0.9440668821334839,0
NVDA,Nvidia suffers a major blow from China,2025-09-16 04:03:00+00:00,-0.9999988079071045,0
NVDA,This Under-the-Radar Data Center Stock Is Soaring Thanks to the AI Boom,2025-09-22 17:43:43+00:00,0.9999779462814331,0
NVDA,MRVL Stock vs. NVIDIA,2025-09-23 14:15:16+00:00,0.0,0
NVDA,Jim Cramer drops shock call on Magnificent 7 stocks,2025-09-16 20:07:00+00:00,0.0,0
NVDA,This Little-Known AI Stock Is Up 70% in 2025 and Analysts Think It Can Rally Further From Here,2025-09-15 15:46:32+00:00,0.9999510049819946,0
NVDA,Why Is Nvidia Stock (NVDA) Soaring Today?,2025-09-10 18:37:30+00:00,0.8969786763191223,0
NVDA,NVIDIA Corporation (NVDA): A Bull Case Theory,2025-09-16 15:45:45+00:00,0.0,0
NVDA,Demand Uptick Boosted NVIDIA (NVDA) in Q2,2025-09-23 13:45:14+00:00,1.0,0
NVDA,JPMorgan Keeps Overweight Rating on NVDA,2025-09-16 18:50:32+00:00,1.0,0
NVDA,Nvidia Just Scored a Major Market Share Win. Should You Buy NVDA Stock Here?,2025-09-03 19:02:50+00:00,0.9999990463256836,0
NVDA,"Nvidia Stock Up 1,124%. Other Winners And Whether To Buy $NVDA",2025-09-24 17:31:27+00:00,0.9999986886978149,0
NVDA,"Dear Nvidia Stock Fans, Mark Your Calendars for September 17",2025-09-16 18:38:30+00:00,0.0,0
NVDA,"Nvidia’s $5B Boost Sends Intel Skyrocketing, But Should You Buy INTC Stock Here?",2025-09-18 12:01:34+00:00,0.9974080920219421,0
NVDA,Wall Street Can’t Get Enough of Nvidia Stock. Is It a Buy Below $180?,2025-09-26 16:24:42+00:00,0.5846362113952637,0
NVDA,JPMorgan Expects Further Upside for NVIDIA (NVDA) Despite Supply Constraints,2025-09-11 09:58:58+00:00,1.0,0
NVDA,NVIDIA (NVDA) Remains a Franchise Pick as Jefferies Reiterates Buy,2025-09-09 19:02:05+00:00,1.0,0
NVDA,William Blair Maintains Bullish Stance on NVIDIA (NVDA) Stock,2025-09-12 10:50:33+00:00,1.0,0
NVDA,Jim Cramer Discusses NVIDIA Corporation (NVDA) & AI Spending,2025-09-12 19:46:54+00:00,0.0,0
NVDA,NVIDIA Corporation (NVDA) Surged Amid Multiple Growth Drivers,2025-09-23 12:34:10+00:00,1.0,0
NVDA,Brad Gerstner Explains Why NVIDIA (NVDA) Will Keep Growing,2025-09-26 13:49:15+00:00,0.0,0
NVDA,Nvidia Drops 3% as China Says the Company Violated Anti-Trust Laws,2025-09-15 12:38:57+00:00,-0.995501697063446,0
NVDA,Super Micro Computer Stock (SMCI) Surges with Nvidia Shipments Underway,2025-09-12 12:42:29+00:00,1.0,0
NVDA,5 Things to Know Before the Stock Market Opens,2025-09-17 12:24:56+00:00,0.0,0
NVDA,Prediction: Nvidia Will Soar Over the Next 5 Years. Here's 1 Reason Why,2025-08-31 15:44:10+00:00,0.8550688028335571,0
NVDA,Insights Into NVIDIA's Performance Versus Peers In Semiconductors & Semiconductor Equipment Sector,2025-09-12 15:09:01+00:00,0.0,0
NVDA,"‘Time to Sell,’ Warns Top Citi Analyst on Intel Stock after Nvidia-Fueled Rally",2025-09-20 20:54:06+00:00,0.0,0
NVDA,"Nvidia Exec Says AI Adoption Lags Because People Don't Trust It, Pushes Open-Source Nemotron As Solution",2025-09-26 08:08:49+00:00,-0.9996341466903687,0
NVDA,Jim Cramer Warns Nvidia's Last Wave Of 'Scared And Hot Money' Could Exit As China Moves To Ban Chip Purchases For Major Tech Firms,2025-09-17 12:13:29+00:00,-0.9999035596847534,0
NVDA,Jim Cramer Reveals Key Factor For AI Stock NVIDIA Corporation (NVDA) That No One’s Talking About,2025-09-03 16:14:22+00:00,0.0,0
NVDA,CoreWeave Plunges 34% From Peak. Is CRWV Stock a Buy Now?,2025-09-22 14:55:17+00:00,0.9980489015579224,0
NVDA,"Rothschild & Redburn Reiterate Buy on Nvidia (NVDA), Cite Strong AI Moat",2025-09-01 04:53:41+00:00,1.0,0
NVDA,"Craig-Hallum Raises NVIDIA (NVDA) Price Target to $245, Reiterates Buy",2025-09-03 12:16:37+00:00,1.0,0
NVDA,Here’s What Makes Nvidia Corporation (NVDA) a Compelling Long-Term Reward-To-Risk Opportunity?,2025-09-03 12:09:48+00:00,0.9999964237213135,0
NVDA,NVIDIA Corp (NVDA) Warns of Legal Risks on Missing Regulations for US 15% AI Chips Fees,2025-09-02 15:13:20+00:00,-0.9980241060256958,0
NVDA,3 Solid Stocks to Buy on Steady Growth in Semiconductor Sales,2025-09-10 14:13:00+00:00,1.0,0
NVDA,Nvidia Is on a Dealmaking Spree: Should You Buy NVDA Stock Amid Fears of an AI Bubble?,2025-09-25 17:30:20+00:00,0.9999853372573853,0
NVDA,Brown Advisors Large-Cap Growth’s Underweight to NVIDIA (NVDA) Affected the Performance,2025-09-10 11:50:56+00:00,-0.9999608993530273,0
NVDA,Dean of Valuation Aswath Damodaran Says He’d Rather Have His Money in Intel Than NVIDIA (NVDA),2025-09-23 13:32:45+00:00,0.0,0
NVDA,"“The Long Knives Are Out” For NVIDIA Corporation (NVDA), Says Jim Cramer",2025-09-10 17:28:39+00:00,0.0,0
NVDA,Nvidia Is Taking Trump’s ‘Stargate’ Idea Global. Should You Buy NVDA Stock Now?,2025-09-18 19:15:56+00:00,0.0,0
NVDA,Dan Niles Says Nvidia (NVDA) Data Center Miss Should Not Be Ignored,2025-09-17 13:19:51+00:00,-0.9611165523529053,0
NVDA,"Alibaba, ByteDance, and Others Remain Keen on NVIDIA (NVDA)’s AI Chips",2025-09-08 14:29:25+00:00,0.0,0
NVDA,NVIDIA (NVDA) Unveils Next-Gen Rubin CPX AI Chips to Handle Complex Software and Video Tasks,2025-09-24 12:45:50+00:00,0.0,0
NVDA,CFRA Reiterates Buy on NVIDIA (NVDA) but Warns of Limited Upside,2025-09-22 21:36:05+00:00,0.9524925947189331,0
NVDA,"NVIDIA Corporation (NVDA) To Invest $100 Billion In OpenAI, Linking Two AI Giants",2025-09-26 14:45:20+00:00,0.0,0
NVDA,NVDA: Nvidia Faces Massive Tailwinds from OpenAI Data Center Expansion,2025-09-02 14:02:37+00:00,0.7953171730041504,0
NVDA,NVDA: Nvidia Keeps AI Growth Story Alive as Broadcom Looms,2025-09-03 20:28:54+00:00,0.9999998807907104,0
NVDA,Jim Cramer Reveals Big Debate Surrounding AI Stock NVIDIA Corporation (NVDA),2025-09-08 15:21:42+00:00,0.0,0
NVDA,Jim Cramer Says NVIDIA Corporation (NVDA)’s China Troubles Are Poorly Times,2025-09-17 17:15:29+00:00,-0.9997242093086243,0
NVDA,"Ditch NVIDIA Corporation (NVDA) For Own Tech, Says Top Chinese Adviser",2025-09-18 15:10:22+00:00,0.0,0
NVDA,Investors Double Down While NVIDIA Corporation (NVDA) Secures Multi-Year AI Wins,2025-09-18 14:53:30+00:00,0.9999982118606567,0
NVDA,"NVIDIA (NVDA) Viewed as Key AI Beneficiary, JPMorgan Reiterates Overweight",2025-09-06 10:09:58+00:00,0.9999998807907104,0
NVDA,"NVIDIA Corporation (NVDA): Take A Look At Jim Cramer’s 1,000+ Words About The Stock After Q2 Earnings",2025-08-31 13:58:27+00:00,0.0,0
NVDA,"The 'Nvidia story' may be coming close to an end, strategist says",2025-09-28 10:30:05+00:00,0.0,0
NVDA,Nvidia’s Rally Is Facing a Reality Check: Should You Buy NVDA Stock Despite Citi’s Target Price Cut?,2025-09-08 17:26:05+00:00,-0.8916853070259094,0
NVDA,Kevin O’Leary is furious at Trump ‘force-feeding’ him Intel — as the US aims to invest taxpayer money in another company,2025-09-26 21:15:00+00:00,0.0,0
NVDA,"Bernstein Stays Bullish on NVIDIA (NVDA), Sees Material Upside Ahead",2025-09-18 21:14:44+00:00,1.0,0
NVDA,NVDA: Nvidia Stock Soars on $100 Billion OpenAI Deal,2025-09-22 19:58:10+00:00,0.0,0
NVDA,NVDA: Nvidia and OpenAI Partnership Could Generate $500 Billion Revenue,2025-09-25 12:26:37+00:00,0.9918428659439087,0
NVDA,5 Things to Know Before the Stock Market Opens,2025-09-15 11:43:55+00:00,0.0,0
NVDA,Bernstein Sees Upside in NVIDIA (NVDA) With Datacenter Growth Potential,2025-09-23 03:33:37+00:00,1.0,0
NVDA,Nvidia Is on a Dealmaking Spree: Should You Buy NVDA Stock Amid Fears of an AI Bubble?,2025-09-25 17:25:06+00:00,0.9999853372573853,0
NVDA,UBS Calls NVIDIA (NVDA) a Buy as AI Growth Story Holds Steady,2025-09-08 03:59:37+00:00,0.9999997615814209,0
NVDA,"Nvidia Is 'Going To $5 Trillion' Says Dan Ives, But This Expert Says If 'AI Turns Out To Be Just A Bubble,' NVDA May Collapse",2025-09-03 02:31:07+00:00,-0.9854173064231873,0
NVDA,"Stock market today: Nasdaq, Dow, S&P 500 rise after Fed signals more cuts, Nvidia bets on Intel",2025-09-17 23:14:48+00:00,0.0,0
NVDA,China’s Cyberspace Administration Orders Major Tech Firms Not to Purchase NVIDIA Corporation (NVDA)’s AI Chips,2025-09-22 22:07:31+00:00,0.0,0
NVDA,Why Analysts See Nvidia’s (NVDA) $100B OpenAI Bet as a Win for GPU Leadership,2025-09-26 23:24:58+00:00,0.9999972581863403,0
NVDA,NVDA: Nvidia Stock Falls as China Flags Breach in Mellanox Deal,2025-09-15 15:45:30+00:00,-0.9999070167541504,0
NVDA,Why Citi Sees NVIDIA (NVDA) Facing Growing Pressure From Broadcom and Google,2025-09-10 18:01:30+00:00,-0.9999749660491943,0
NVDA,NVIDIA (NVDA) Stock Backed by Wells Fargo Amid Expanding AI Opportunities,2025-09-12 22:05:52+00:00,0.9999974966049194,0
NVDA,Has Nvidia Lost Sight of the Core Consumer?,2025-09-14 18:51:26+00:00,-0.9985905289649963,0
NVDA,NVDA or QBTS: Which is the Better Bet for Quantum Investors in 2025?,2025-09-17 19:00:00+00:00,0.9973322153091431,0
NVDA,Uncertainty Around NVDA Chips in China,2025-09-19 04:46:14+00:00,-0.9999991655349731,0
NVDA,Was Jim Cramer Right About NVIDIA (NVDA)?,2025-09-09 21:19:03+00:00,0.0,0
NVDA,Jim Cramer Calls NVIDIA the Greatest Stock He Has Ever Laid Eyes On,2025-09-04 16:17:52+00:00,0.5506682395935059,0
NVDA,Big Tech stocks hold steady after Trump visa fees crackdown,2025-09-22 06:33:24+00:00,0.9804663062095642,0
NVDA,‘The Message Is Loud and Clear’ That China Doesn’t Want Nvidia’s Chips. How Much Does That Matter for NVDA Stock in 2025?,2025-09-22 17:55:31+00:00,0.0,0
NVDA,Supermicro Stock Rises on News of Product Shipments Using Nvidia Blackwell Chips,2025-09-12 14:44:26+00:00,0.0,0
NVDA,5 Things to Know Before the Stock Market Opens,2025-09-17 12:12:38+00:00,0.0,0
NVDA,"Stock market today: Dow, S&P 500, Nasdaq hit records as rate-cut relief, Nvidia's Intel bet lift markets",2025-09-18 20:00:41+00:00,0.994631290435791,0
NVDA,"Stock market today: Dow, S&P 500, Nasdaq futures pull back from records as gold powers to fresh high",2025-09-21 23:44:23+00:00,0.0,0
NVDA,"Dow, S&P 500, Nasdaq futures pull back from records as gold powers to fresh all-time high",2025-09-21 23:44:23+00:00,0.5480555891990662,0
NVDA,Bank of America Nvidia-OpenAI call puts half trillion on the table,2025-09-24 16:03:00+00:00,0.0,0
NVDA,The ‘Irrational Exuberance’ in AI Stocks Isn’t Going Anywhere. Buy These 3 Top-Rated Names Here.,2025-09-23 16:33:25+00:00,0.0,0
NVDA,"Broadcom Developing an AI Chip With Big New Customer OpenAI, Reports Say",2025-09-05 11:20:23+00:00,0.0,0
NVDA,"Dow, S&P 500, Nasdaq futures edge lower on heels of record highs",2025-09-21 23:44:23+00:00,-0.9992362260818481,0
NVDA,Nvidia (NVDA) Equips GeForce Now with RTX 5080 Blackwell SuperPods,2025-09-27 00:37:25+00:00,0.0,0
MSFT,Buy 5 Big Data Behemoths to Benefit From Enormous Market Opportunity,2025-09-15 11:18:00+00:00,1.0,0
MSFT,Why Is SoundHound AI (SOUN) Stock Soaring Today,2025-09-08 18:26:13+00:00,0.0,0
MSFT,Business and Tech leaders respond to the Google antitrust ruling after a judge spared it from a Chrome sell-off,2025-09-03 02:33:20+00:00,0.0,0
MSFT,MSFT Stock Analysis: Is Microsoft Stock A Buy At $510?,2025-09-15 14:30:21+00:00,0.9996994733810425,0
MSFT,This Quantum Computing Stock Is Poised to Dominate. Why Analysts Think You Should Buy It Here.,2025-09-01 15:10:03+00:00,0.9999892711639404,0
MSFT,"GOOGL Stock Vs. AMZN, MSFT & META",2025-09-16 13:57:10+00:00,0.0,0
MSFT,Microsoft’s (MSFT) Cloud Deal Boosts Federal Market Presence,2025-09-04 17:43:44+00:00,1.0,0
MSFT,Jim Cramer drops shock call on Magnificent 7 stocks,2025-09-16 20:07:00+00:00,0.0,0
MSFT,Bitcoin Miners Surge Following Microsoft’s $17.4B AI Bet,2025-09-09 20:19:13+00:00,0.9999896287918091,0
MSFT,Inquiry Into Microsoft's Competitor Dynamics In Software Industry,2025-09-12 15:09:28+00:00,-0.9911032915115356,0
MSFT,Palo Alto Networks: Is PANW Stock The Best Bet In Cybersecurity?,2025-09-10 13:28:59+00:00,0.9987469911575317,0
MSFT,Understanding Microsoft's Position In Software Industry Compared To Competitors,2025-09-22 15:15:16+00:00,0.0,0
