Ticker,title,Date,news_sentiment_score,positive_keywords_count
PG,US files lawsuit against California utility over Los Angeles wildfires,2025-09-04 22:42:55+00:00,-0.9354569315910339,0
PG,"Fantasy Basketball Guards 2025-26: Top 50 rankings, season outlooks, key stats",2025-09-22 20:16:52+00:00,0.0,0
PG,"12-Team, 9-Cat Roto Mock Draft: Building around Shai Gilgeous-Alexander",2025-09-19 18:00:00+00:00,0.0,0
PG,Utilities Building Remote Grids Where Power Lines Can’t Reach,2025-09-19 09:00:00+00:00,0.0,0
PG,The Procter & Gamble Company (PG): A Household Name Among Dividend Paying Stocks,2025-09-21 03:14:45+00:00,0.0,0
PG,James Gunn’s ‘Superman’ Coming To HBO Max This Week,2025-09-18 11:00:00+00:00,0.0,0
PG,A Netflix ‘KPop Demon Hunters’ Short Film Has Been Rated For Release,2025-09-17 14:46:40+00:00,0.0,0
PG,Live-Action ‘How To Train Your Dragon’ Gets Peacock Streaming Date,2025-09-10 15:51:01+00:00,0.0,0
PG,Domestic violence comments on fishing show breached classification rules,2025-09-18 05:59:35+00:00,-0.9996397495269775,0
PG,How Soon Will Disney’s ‘Freakier Friday’ Arrive On Streaming?,2025-09-07 11:00:00+00:00,0.0,0
PG,Wolverine claws more people in the head in the new Wolverine trailer than I think he did in all the comics I read as a kid,2025-09-24 22:19:31+00:00,0.0,0
PG,"PG Kinney, No. 17 hoops recruit, picks Jayhawks",2025-09-28 17:50:18+00:00,0.0,0
PG,"Jefferies Raises PT on PG&E Corporation (PCG), Keeps a Buy",2025-09-15 12:15:28+00:00,0.9999990463256836,0
PG,Rajasthan Governor accepts resignation of Kumar Vishwas’ wife from RPSC after court’s scathing remarks in paper leak case,2025-09-15 12:19:14+00:00,0.0,0
PG,‘Stitch Head’ Feature Adaptation Debuts Teaser Ahead Of Halloween Theatrical Launch (EXCLUSIVE),2025-09-04 16:32:44+00:00,0.0,0
PG,KPOP DEMON HUNTERS Is Getting a Short Film Prequel Story,2025-09-18 17:28:00+00:00,0.0,0
PG,I found a Paramount+ deal that works out to just $2.50 a month – here are the 5 movies I’d stream first out of 127 new additions,2025-09-04 13:37:21+00:00,0.0,0
PG,"Liam Neeson’s ‘The Naked Gun’ Gets Paramount+ Streaming Date, Report Says",2025-09-10 17:03:55+00:00,0.0,0
PG,‘Mission: Impossible – The Final Reckoning’ Streaming Price Drops Big,2025-09-16 21:20:58+00:00,-0.9993764758110046,0
PG,‘Karate Kid: Legends’ Arrives On Netflix This Week,2025-09-23 16:22:08+00:00,0.0,0
PG,"Netflix added 61 new movies in September, but I’m only watching these 3",2025-09-16 12:16:34+00:00,0.0,0
PG,Hidden bacterial molecules in the brain reveal new secrets of sleep,2025-09-25 07:48:24+00:00,0.0,0
PG,Fire Fund Helps Raise PG&E to Investment Grade Six Years After Bankruptcy,2025-09-26 17:26:12+00:00,0.9978204965591431,0
PG,Five Nights at Freddy’s 2 secures a PG-13 rating,2025-09-10 17:36:54+00:00,0.0,0
PG,Ralph Macchio And Jackie Chan’s ‘Karate Kid: Legends’ Gets Netflix Date,2025-09-13 14:02:56+00:00,0.0,0
PG,‘The Fantastic Four: First Steps’ Gets Streaming Date,2025-09-16 15:07:02+00:00,0.9998764991760254,0
PG,"‘Downton Abbey: The Grand Finale’ New On Streaming This Week, Report Says",2025-09-27 22:24:39+00:00,0.0,0
PG,Calling AI chatbots 'Clankers' is clunky and clueless,2025-09-04 05:00:00+00:00,0.0,0
PG,Kansas basketball recruiting: Five-star PG Taylen Kinney commits to Jayhawks live on CBS Sports HQ,2025-09-28 17:31:02+00:00,0.0,0
PG,"‘Downton Abbey: The Grand Finale’ Gets Streaming Date, Report Says",2025-09-24 18:25:08+00:00,0.0,0
PG,DOE Asks Industry For Ideas About Feeding Power Hungry Data Centers,2025-09-28 03:14:47+00:00,0.0,0
PG,Bob Odenkirk’s Transformation Into John Wick Is Just Beginning,2025-09-07 15:00:00+00:00,0.0,0
PG,PG&E Corporation (PCG) Q2 Earnings Fall Short as Operating and Maintenance Costs Rise,2025-09-04 18:59:02+00:00,-0.9999991655349731,0
PG,Live-Action Smash ‘Lilo & Stich’ New On Disney+ This Week,2025-08-31 01:40:37+00:00,0.0,0
PG,"‘Peacemaker’ Just Made The Old, Bad ‘Suicide Squad’ Movie DCU Canon",2025-09-06 13:52:13+00:00,0.0,0
PG,Fantasy basketball PG tiers: Shai Gilgeous-Alexander leads but several candidates could challenge the throne,2025-09-02 17:57:52+00:00,-0.997704803943634,0
PG,Is Kimberly-Clark Stock Underperforming the S&P 500?,2025-09-10 08:34:28+00:00,-0.9509674906730652,0
PG,How PG&E Plans to Power Ahead on Climate Goals,2025-09-08 10:00:02+00:00,0.0,0
PG,Is Kenvue Stock Underperforming the Dow?,2025-09-11 13:38:12+00:00,-0.9394856095314026,0
PG,"Who pays for wildfire damage? In the West, utilities are shifting the risk to customers",2025-09-19 08:30:00+00:00,-0.9914542436599731,0
PG,Is Edison International Stock Outperforming the S&P 500?,2025-09-15 14:03:59+00:00,0.9998834133148193,0
PG,How Is Colgate-Palmolive’s Stock Performance Compared to Other Consumer Staples Stocks?,2025-09-04 10:32:13+00:00,0.0,0
PG,"The Procter & Gamble Company (PG) to Cut 7,000 Jobs, Streamline Portfolio for Growth",2025-09-28 22:43:52+00:00,0.6320797801017761,0
PG,‘The Senior’ Review: Michael Chiklis In An Inspiring True (!) Story About A 59 Year Old College Linebacker,2025-09-19 18:47:45+00:00,0.0,0
PG,‘Rental Family’ Review: Brendan Fraser In A Gentle Family Comedy About Finding Human Connection In Japan – Toronto Film Festival,2025-09-07 03:05:00+00:00,0.0,0
PG,"Five Nights At Freddy's 2 Is Repeating A Criticized Aspect Of The First Movie, But I Think It Makes Sense",2025-09-11 16:23:25+00:00,0.0,0
PG,The Procter & Gamble Company (PG) Focused on Innovation and Efficiency to Accelerate Growth,2025-09-15 13:03:36+00:00,0.9992839694023132,0
PG,Coming soon,2025-09-11 23:49:00+00:00,0.0,0
PG,"Wall Street Has a Mixed Opinion About Procter & Gamble Company (PG), Here’s Why",2025-09-16 15:55:11+00:00,0.0,0
PG,Macquarie Core Equity Fund Sold The Procter & Gamble Co. (PG) at Reasonable Gains,2025-09-19 12:10:43+00:00,0.9996356964111328,0
PG,2025-26 Fantasy Basketball PG Rankings for Points Leagues,2025-09-19 20:03:07+00:00,0.0,0
PG,A Blessing and a Curse,2025-09-09 13:00:33+00:00,0.0,0
PG,Tay Kinney predicted to commit to Kansas; update on decision plans,2025-09-16 22:14:41+00:00,0.0,0
PG,WATCH: Five-star PG Taylen Kinney set to make college commitment live Sunday on CBS Sports HQ,2025-09-28 13:53:08+00:00,0.0,0
PG,Fantasy basketball mock draft analysis 2025-26: Is Nikola Jokic the top pick?,2025-09-16 17:00:00+00:00,0.0,0
PG,One Battle After Another is terrifying. That's why it's great,2025-09-17 16:00:00+00:00,0.999995231628418,0
PG,Kentucky extends offer to 5-star PG Nasir Anderson,2025-09-15 19:13:30+00:00,0.0,0
PG,"James Gunn Confirms MAN OF TOMORROW and PEACEMAKER Season 2 Are ""Very, Very, Connected""",2025-09-08 17:55:00+00:00,0.0,0
HD,Verge readers can get 20 percent off Nanoleaf wall lights,2025-09-18 19:35:22+00:00,0.0,0
HD,No way! Early Prime Day deal knocks 36% off my favorite Fire Tablet for sharing,2025-09-19 19:05:09+00:00,0.0,0
HD,The blind box trend comes to tech with this tiny digital Kodak camera,2025-09-10 15:52:43+00:00,0.0,0
HD,Elon Musk’s Favorite Game Is Getting Remastered 25 Years Later,2025-09-24 22:19:16+00:00,0.0,0
HD,This Amazon iPad Alternative Has No Weak Points and Sells for Pennies on the Dollar,2025-09-20 13:17:22+00:00,0.0,0
HD,This early Prime Day deal has knocked 40% OFF my favorite smart TV replacement,2025-09-17 20:00:24+00:00,-0.9994021654129028,0
HD,"After Months Without a Discount, ASUS’s 15.6” Portable Monitor Drops Again Ahead of Prime Big Deal Days",2025-09-22 16:35:24+00:00,0.0,0
HD,Dragon Quest VII Remake Looks Like The Perfect Way To Revive A Classic,2025-09-15 16:45:30+00:00,0.9998608827590942,0
HD,Amazon’s next Prime Day sale is happening on October 7th,2025-09-16 04:28:23+00:00,0.0,0
HD,Enhanced Definition TV: “A Poor Man’s High-Def”,2025-09-18 20:00:26+00:00,-0.9986696243286133,0
HD,"If You Stream on Plex, You Need to Reset Your Password Now",2025-09-09 17:06:19+00:00,0.0,0
HD,"Windows 11 Pro, Intel i7, 2TB SSD, 64GB RAM: HP Slashes $2600 From Its 5/5 Rated Laptop",2025-09-10 12:40:49+00:00,0.0,0
HD,"HP Seems to Be Clearing Out a Bestseller, Its 17″ Laptop Bundle Just Crashed 70% (32GB RAM, 1TB SSD)",2025-09-16 13:10:22+00:00,0.9999847412109375,0
HD,"This Elite-Level HP Laptop Bundle (64GB RAM, 2TB SSD) Drops Again Overnight, 72% Off and Likely as Low as It Gets",2025-09-11 14:40:06+00:00,-0.9992074370384216,0
HD,"This 5-Star Fully Loaded Dell Copilot Laptop Is 70% Off, and Comes With a $400 Value Accessory Bundle for Free",2025-09-19 14:10:08+00:00,0.0,0
HD,These Limited-Edition NFL Echo Dot Bundles Hit an All-Time Low Right as the Football Season Kicks Off,2025-09-12 15:10:16+00:00,-0.9059545397758484,0
HD,"Lenovo Clears Out Its 4.8-Star Copilot AI Laptop (40GB RAM, 1TB SSD) at 73% Off, You Could Buy Several for the Price of One",2025-09-09 15:40:44+00:00,0.0,0
HD,"In Octopath Traveler 0, Revenge Is a Dish Best Served in HD-2D",2025-09-09 15:00:00+00:00,0.9995818734169006,0
HD,Spotify Premium Users Get Lossless Streaming After Years of Delays,2025-09-10 11:27:51+00:00,-0.9954919219017029,0
HD,"Amazon Cuts Its Profit on This HP Laptop (1TB, Windows 11 Pro, Office), Now HP’s Clear Best Seller",2025-09-25 18:50:53+00:00,-0.9961963891983032,0
HD,"Dell’s 5-Star Laptop (64GB RAM, 2TB SSD) Crashes to 63% Off After Three Cuts in a Month, Now Cheaper Than iPad Pro",2025-09-24 15:10:42+00:00,0.7692499756813049,0
HD,South Korea's HD Hyundai Heavy in talks to buy US shipyard,2025-09-18 08:54:35+00:00,0.0,0
HD,"Normally You’d Have to Be a Pirate to Steal an HP Flagship Laptop, but Amazon Lets You Do It at 72% Off",2025-09-22 14:50:09+00:00,0.0,0
HD,Spotify Lossless is an inconvenient improvement,2025-09-13 13:01:46+00:00,-0.9999779462814331,0
HD,Prime members can get three months of Kindle Unlimited for free,2025-09-19 20:30:13+00:00,0.0,0
HD,"Dell’s 15.6″ Laptop (32GB RAM, 1TB SSD) Is $2,200 Off With Accessories, Making It an Almost Free Bundle",2025-09-03 15:40:42+00:00,0.0,0
HD,Samsung PRO Plus 1TB microSD Memory Card With Adapter Is Now $15 Cheaper Than Black Friday Pricing,2025-09-04 13:40:31+00:00,0.0,0
HD,"The Ray-Ban Meta Gen 2 is here, rocking two new upgrades that make all the difference",2025-09-18 00:20:35+00:00,0.0,0
HD,Ditch the old laptop - this 2-in-1 HP Chromebook Plus just scored $180 OFF at Best Buy,2025-09-24 19:17:53+00:00,0.0,0
HD,"Square Enix reveals original content for Dragon Quest I + II HD-2D Remake — new stories, powers, dungeons, and more are inbound for this two-pack remake",2025-09-23 19:05:00+00:00,0.0,0
HD,"Samsung Galaxy S25 audio: Bluetooth quality, sound profiles, wired headphones, and more",2025-09-03 18:45:12+00:00,0.0,0
HD,Dragon Quest I + II HD-2D Remake details new underwater level — Get a literal deep dive into the expansive new region,2025-09-25 22:00:00+00:00,0.0,0
HD,tvOS 26 adds new feature that makes AirPlay speakers better than ever,2025-09-05 20:39:02+00:00,1.0,0
HD,"Refurbished: 32GB Amazon Fire HD 10 Tablet (w/ Lockscreen Ads, 2021) $35 + Free Shipping w/ Amazon Prime",2025-09-15 01:20:44+00:00,0.0,0
HD,"3x Cheaper Than Apple Headphones, This HP Laptop with Windows 11 Is Flying Off the Shelves",2025-09-21 12:25:47+00:00,0.0,0
HD,"Two USB-C Ports, Two USB-A Ports and an HDMI: This 7-in-1 Adapter Is Going for Pennies on Amazon",2025-09-19 20:51:48+00:00,0.0,0
HD,"This Dell Laptop with Ryzen 7 and Crazy Specs Is 73% Off on Amazon, Stock Is Flying Out",2025-09-10 13:40:33+00:00,0.0,0
HD,"Samsung’s 27-Inch Smart Monitor With Free Live TV Channels Is Nearly 50% Off, A Practically Free TV Replacement",2025-09-10 15:10:06+00:00,0.0,0
HD,This 16″ Portable Monitor with Kickstand Is Ideal for Netflix Bingeing and It’s Selling for Pennies,2025-09-20 12:40:36+00:00,0.0,0
HD,"DJI Is Clearing Out Its Summer Stock of Mini 4K Drones, Prices Back to Black Friday Lows",2025-09-23 19:58:38+00:00,0.0,0
HD,"Dell’s Flagship Laptop Bundle (64GB RAM, 2TB SSD) Crashes to 71% Off, While Lower Specs Still Cost More",2025-09-25 13:27:44+00:00,0.882788360118866,0
HD,"Select TV Seasons / Films (Digital HD/4K): Chernobyl: Season 1 (HD), Barbie (4K) $5 each & More",2025-09-23 07:13:25+00:00,0.0,0
HD,Reolink continues innovating with two new major product launches at IFA 2025,2025-09-05 13:00:32+00:00,0.9973478317260742,0
HD,Motorola's cheap 2026 mid-range phones start showing off in leaked renders,2025-09-12 10:58:00+00:00,-0.6274622082710266,0
HD,Amazon gears up for the big reveal of its fresh devices later this month,2025-09-15 22:27:48+00:00,0.0,0
HD,Sony’s Xperia 10 VII takes a page from the Pixel’s design playbook,2025-09-15 11:21:50+00:00,0.0,0
HD,Octopath Traveler 0 Hands-On: Way More Than Just A Mobile Game Remake,2025-09-03 13:24:18+00:00,0.0,0
HD,"Rated 4.5 out of 5, This HP Student Laptop Is Now 75% Off as Amazon Cuts Prices to Clear Shelves",2025-08-31 14:20:15+00:00,0.0,0
HD,"HP Clears Out Its 14″ Laptop Bundle at Over 80% Off, Even Cheaper Than an Entry-Level Apple iPad",2025-09-03 12:10:27+00:00,0.0,0
HD,"Xbox Series S (512GB, Controller Included) Is Back at a Low Price on Amazon Despite Microsoft’s Price Hike",2025-09-05 12:10:49+00:00,0.0,0
HD,The Terminator (4K Ultra HD + Digital) $17,2025-09-13 21:14:19+00:00,0.0,0
HD,"Apple releases tvOS 26 software update for Apple TV, here’s what’s new",2025-09-15 17:28:57+00:00,0.0,0
HD,Godzilla: King of the Monsters (4K UHD + Blu-ray) $11,2025-09-09 20:24:13+00:00,0.0,0
HD,Dragon Quest I & II HD-2D Remake: how Square Enix rebuilt two classic games for a new generation,2025-09-04 15:02:03+00:00,0.0,0
HD,Thinking About Buying An Amazon Fire Stick? Here Are 5 Things You Need To Know,2025-09-14 13:17:00+00:00,0.0,0
HD,Supernatural: The Complete Series (2005) (Digital HD TV Show) $30,2025-09-12 12:08:17+00:00,0.0,0
HD,Samsung Galaxy Z Fold 7 vs. Honor Magic V5: What's the best foldable?,2025-09-10 05:18:20+00:00,0.9887627959251404,0
HD,The Final Fantasy Tactics Remaster Won Me Over Despite Some Nitpicks,2025-09-02 13:35:04+00:00,0.0,0
HD,"Amazon Is Going Nuts, This 15″ Gaming Portable Monitor for Xbox and Switch Is Selling for Pennies",2025-09-19 21:40:55+00:00,0.0,0
HD,"NordVPN Is Free for 20 Months, But Here’s the Condition You Need to Meet",2025-09-11 13:10:34+00:00,0.0,0
HD,"Ding, Ding, Ding! Who Makes the Better Trucks: Ford vs. Chevrolet",2025-09-13 14:00:29+00:00,0.0,0
HD,"This $2700 Dell Laptop Is Practically Free Right Now, With Amazon Clearing Stock Until It Sells Out",2025-09-08 11:07:21+00:00,0.0,0
HD,"This 1TB HP Laptop Is Now $499 Instead of $2499, Amazon Just Cut $2000 Off the Price",2025-09-01 19:02:29+00:00,0.0,0
HD,"How to watch Tokyo Game Show 2025 — Start times, platforms, and everything else you need to know",2025-09-09 11:16:00+00:00,0.0,0
HD,"A GoPro Costs Hundreds of Dollars, But This Action Camera on Amazon Is Just $56",2025-09-04 16:21:48+00:00,0.0,0
HD,"At just $60, one of our favorite tablets for kids nears its best price ever",2025-09-17 17:49:20+00:00,0.9999985694885254,0
HD,Retrotechtacular: Exploring the Moon on Surveyor 1,2025-09-07 17:00:50+00:00,0.0,0
HD,Tech Talk: What is lossless audio? Understanding Spotify's new feature and why it matters,2025-09-18 15:20:42+00:00,0.0,0
HD,Next Apple TV Expected to Launch This Year With These New Features,2025-09-22 17:00:39+00:00,0.0,0
HD,"Apple’s F1 movie gets Blu-ray release date, limited edition steelbook",2025-09-17 16:53:40+00:00,0.0,0
HD,4.3″ Lightswim 1080P IPS HD Borescope w/ LED Lights & 16.5′ Cable $14.95,2025-09-16 04:50:19+00:00,0.0,0
HD,Ring Indoor Cam (2nd Gen) w/ 1080p HD Video & Color Night Vision $25,2025-09-28 15:44:38+00:00,0.0,0
HD,Timeless: The Complete Series (2016) (Digital HD TV Show) $10 or Less,2025-09-26 07:03:29+00:00,0.0,0
HD,Suikoden I & II HD Remaster (PlayStation 5) $22 + Free S/H w/ Amazon Prime,2025-09-08 01:12:58+00:00,0.0,0
HD,"Pacific allies are ready to help fix US shipbuilding, senators say, but confusion is standing in the way",2025-09-07 12:24:02+00:00,0.0,0
HD,Grab the Xreal One Pro AR glasses and Beam Pro bundle for $50 off this Labor Day,2025-09-01 06:44:26+00:00,0.0,0
HD,Batman: Mask of the Phantasm (4K UHD + Digital) $12.50,2025-09-20 17:50:08+00:00,0.0,0
HD,Batman 30th Anniversary Edition (1989) (4K UHD + Blu-ray) $10.50,2025-09-24 20:03:01+00:00,0.0,0
HD,Futurama: Seasons 1-10 (Digital SD TV Show) $25,2025-08-31 08:49:25+00:00,0.0,0
HD,Octopath Traveler 0 Platform Specs Reveal Town Size Limitations on Some Devices,2025-09-08 22:32:50+00:00,0.0,0
HD,"Dragon Quest VII Reimagined is coming to Xbox — This remade JRPG classic will also include Xbox Play Anywhere support, perfect for on-the-go gamers",2025-09-13 11:22:08+00:00,0.0,0
HD,Dragon Quest 7 Remake Announced After Months Of Speculation,2025-09-12 13:39:00+00:00,0.0,0
HD,Rugged adventure tablet first to throw FHD visuals on the go,2025-09-13 01:03:00+00:00,0.0,0
HD,One Of The Best Puzzle RPGs Of All Time Is Getting A Remaster,2025-09-04 16:48:31+00:00,0.9770240187644958,0
HD,Dragon Quest 7 is getting a full remake - and it's not HD-2D,2025-09-12 15:31:18+00:00,0.0,0
HD,I wouldn't get too excited for Dragon Quest Smash/Grow,2025-09-17 14:26:54+00:00,-0.8963176012039185,0
HD,Our favorite Chromebook just fell to $550 at Amazon for a limited time,2025-09-10 18:54:07+00:00,0.0,0
HD,I tried living with a Windows Phone in 2025 and it worked better than I expected,2025-08-31 16:00:16+00:00,1.0,0
HD,"26 years later, this excellent 4X space strategy game still has plenty of firepower, and it's also now free",2025-09-03 09:16:18+00:00,0.9999990463256836,0
HD,Asia Cup on Sling TV: How to Watch the 2025 Cricket Tournament Live Online,2025-09-18 16:00:00+00:00,0.0,0
HD,Lax Space: Designing With Duct Tape and Everyday Chaos,2025-09-23 09:51:01+00:00,0.0,0
HD,Xbox Tokyo Game Show 2025 — every reveal and trailer you might have missed,2025-09-25 14:00:00+00:00,0.0,0
HD,How to Watch Phish’s Headlining Bourbon & Beyond Set,2025-09-12 18:04:25+00:00,0.0,0
HD,Everything We Saw At Today’s Xbox Tokyo Game Show 2025 Event,2025-09-25 13:38:17+00:00,0.0,0
HD,Final Fantasy Tactics: The Ivalice Chronicles: The Kotaku Review,2025-09-24 13:00:10+00:00,0.0,0
HD,"New precise, personalized brain stim therapy rapidly treats depression",2025-09-16 17:03:00+00:00,0.0,0
HD,Don't miss out on Logitech's end-of-summer sale,2025-09-04 22:03:18+00:00,0.0,0
HD,Roku's New Smart Device Goes Beyond The Streaming Stick,2025-09-16 21:02:56+00:00,0.0,0
HD,How To Take Instagram-Worthy Photos Of The Moon With Your iPhone,2025-09-18 18:17:00+00:00,0.0,0
HD,Chucky Complete TV Series Releases On Blu-Ray This Week With A Collectible Steelbook,2025-09-22 05:00:00+00:00,0.0,0
NFLX,"If Markets Crash, Netflix Stock Falls Hard",2025-09-12 12:59:33+00:00,-0.9964190721511841,0
NFLX,Netflix’s (NFLX) Results Exceeded Expectations Amid Macroeconomic Challenges,2025-09-09 13:32:21+00:00,0.9999990463256836,0
NFLX,Netflix’s (NFLX) Unusual Options Presents an Opportunity Before Its Volatility Skew Widens,2025-09-01 17:30:02+00:00,0.9996902942657471,0
NFLX,"As Netflix Stock Falls Below $1,250, Should You Binge Watch Or Keep Chilling?",2025-09-15 19:49:37+00:00,-0.725361168384552,0
NFLX,"Netflix upgraded, Five Below initiated: Wall Street's top analyst calls",2025-09-17 13:43:13+00:00,0.0,0
NFLX,Here’s Why Trade Desk Stock (TTD) Plunged 12% in a Single Day,2025-09-12 15:08:54+00:00,-0.9999420642852783,0
NFLX,Netflix Ads On Track To Double As YouTube Competition Heats Up,2025-09-25 17:29:28+00:00,0.9998466968536377,0
NFLX,Is Netflix Stock Outperforming the Nasdaq?,2025-09-01 13:41:21+00:00,0.9996888637542725,0
NFLX,"As Amazon Copies The Netflix Playbook, Can AMZN Stock Copy The 425% Gains In NFLX?",2025-09-05 13:59:16+00:00,0.999995231628418,0
NFLX,"Loop Capital Upgrades Netflix, Inc. (NFLX) To Buy, Lifts Price Target",2025-09-26 14:46:51+00:00,0.9999967813491821,0
NFLX,Why Netflix (NFLX) Stock Is Gaining Today?,2025-09-17 19:24:09+00:00,0.9999940395355225,0
NFLX,Should You Invest in Netflix (NFLX)?,2025-09-19 12:34:06+00:00,0.0,0
NFLX,Do You Believe in Netflix’s (NFLX) Strong and Sustainable Competitive Advantages?,2025-09-03 12:04:27+00:00,0.9999992847442627,0
NFLX,"KeyBanc Reaffirms Overweight Rating for Netflix (NFLX), Sees Strong Ad Revenue Growth",2025-09-21 07:59:26+00:00,1.0,0
NFLX,NFLX: Netflix Shares Tumble as Rivals Circle in on Streaming Market,2025-09-12 12:12:27+00:00,-0.9999992847442627,0
NFLX,Netflix Chief Product Officer Eunice Kim to Depart; CTO Elizabeth Stone Appointed as Interim Successor,2025-09-14 05:02:33+00:00,0.0,0
NFLX,Netflix Stock Is Up 40% in 2025 But Wall Street Isn’t Backing Down. Should You Buy NFLX Now?,2025-09-22 19:17:59+00:00,0.0,0
NFLX,"Advisors Capital Boosts Netflix, Inc. (NFLX) Stake as Company Partners with Amazon Ads",2025-09-18 14:56:20+00:00,0.9997276663780212,0
NFLX,Netflix’s (NFLX) Seasonal Tailwinds and Pricing Power Justify Bernstein’s Buy Rating,2025-09-16 17:34:17+00:00,1.0,0
NFLX,Bernstein Maintains Outperform Rating for Netflix (NFLX) Amid Content Licensing Concerns,2025-09-21 08:11:24+00:00,1.0,0
NFLX,"Netflix Stock Upgraded To Buy, Retakes Key Level",2025-09-17 20:17:51+00:00,0.9999991655349731,0
NFLX,"If You Invested In Netflix When It Was Still a DVD Rental Service, Here’s How Much You’d Have Today",2025-09-19 16:40:35+00:00,0.0,0
NFLX,"If You Invested $100 In Netflix Stock 5 Years Ago, You Would Have This Much Today",2025-09-12 15:54:13+00:00,0.0,0
NFLX,Paramount-Skydance's reported bid for Warner Bros. Discovery could spark media bidding war,2025-09-13 15:00:22+00:00,0.4297463893890381,0
NFLX,Cathie Wood Is Buying the Dip in Figma Stock. Should You?,2025-09-10 18:00:32+00:00,0.0,0
NFLX,Jim Cramer Says He Likes Netflix Stock,2025-09-07 09:30:53+00:00,0.0,0
NFLX,Kurv Yield Premium Strategy Netflix (NFLX) ETF (BATS:NFLP) Trading Down 0.5% – Here’s Why,2025-09-25 07:20:47+00:00,-0.9995046854019165,0
NFLX,Stocks Rally and Bond Yields Fall on Fed Rate Cut Hopes,2025-09-11 15:10:46+00:00,-0.6654371023178101,0
NFLX,Netflix Lifts Revenue Guidance While Raising Concern Margin Pressure from Higher Content Spend,2025-09-27 18:16:55+00:00,1.0,0
NFLX,"AMC Entertainment Holdings, Inc. (AMC): A Bull Case Theory",2025-09-28 23:45:40+00:00,0.0,0
NFLX,Netflix’s (NFLX) Results Exceeded Expectations Amid Macroeconomic Challenges,2025-09-09 13:49:57+00:00,0.9999990463256836,0
NFLX,Bullish on Netflix? Here’s What Valuation Indicates for NFLX Stock,2025-09-05 15:17:26+00:00,0.9998866319656372,0
NFLX,"Jump Financial LLC Has $869,000 Stake in Netflix, Inc. $NFLX",2025-08-31 08:58:53+00:00,0.0,0
NFLX,Strong Results Boosted The Trade Desk (TTD) in Q2,2025-09-10 11:58:09+00:00,1.0,0
NFLX,"S&P 500 Gains & Losses Today: Warner Bros. Discovery Stock Soars; Oracle, Netflix Slip",2025-09-11 20:35:47+00:00,0.0,0
NFLX,Netflix Joins Google On Two Elite Lists. Now The Trial Begins,2025-09-15 15:45:53+00:00,0.0,0
NFLX,Netflix Is Just Getting Started: Here Are 3 Growth Drivers for the Next Few Years,2025-09-13 19:58:17+00:00,0.9054976105690002,0
NFLX,Netflix's Ad Business: Game Changer or Overhyped?,2025-09-16 14:30:07+00:00,0.0,0
NFLX,"If You Invested In Netflix When It Was Still a DVD Rental Service, Here’s How Much You’d Have Today",2025-09-19 16:54:02+00:00,0.0,0
NFLX,"New Google AI TV tool could change how Netflix is found, watched",2025-09-24 18:58:22+00:00,0.0,0
NFLX,"3,774 Shares in Netflix, Inc. $NFLX Bought by Financiere des Professionnels Fonds d investissement inc.",2025-09-20 07:56:55+00:00,0.0,0
NFLX,Do You Believe in Netflix’s (NFLX) Strong and Sustainable Competitive Advantages?,2025-09-03 12:16:41+00:00,0.9999992847442627,0
NFLX,Netflix’s (NFLX) Unusual Options Presents an Opportunity Before Its Volatility Skew Widens,2025-09-01 17:41:53+00:00,0.9996902942657471,0
NFLX,Netflix’s (NFLX) Seasonal Tailwinds and Pricing Power Justify Bernstein’s Buy Rating,2025-09-16 17:51:26+00:00,1.0,0
NFLX,"Wedge Capital Management L L P NC Has $404,000 Stock Holdings in Netflix, Inc. $NFLX",2025-09-24 08:10:57+00:00,0.0,0
NFLX,"As Amazon Copies the Netflix Playbook, Can AMZN Stock Copy the 425% Gains in NFLX?",2025-09-04 16:35:48+00:00,0.999995231628418,0
NFLX,"Advisors Capital Boosts Netflix, Inc. (NFLX) Stake as Company Partners with Amazon Ads",2025-09-18 15:23:02+00:00,0.9997276663780212,0
NFLX,"Loop Capital Upgrades Netflix, Inc. (NFLX) To Buy, Lifts Price Target",2025-09-26 15:12:28+00:00,0.9999967813491821,0
NFLX,AB InBev and Netflix Announce Global Brand Partnership,2025-09-22 11:09:39+00:00,0.0,0
NFLX,Netflix (NASDAQ:NFLX) Given “Buy” Rating at Needham & Company LLC,2025-09-11 07:13:09+00:00,0.9999281167984009,0
NFLX,$100 Invested In Netflix 5 Years Ago Would Be Worth This Much Today,2025-09-02 21:25:30+00:00,0.0,0
NFLX,This Bearish Trade Might Work Best If Netflix Stock Is Fading,2025-09-19 15:03:00+00:00,-0.6730576753616333,0
NFLX,Netflix Stock Is Up 40% in 2025 But Wall Street Isn’t Backing Down. Should You Buy NFLX Now?,2025-09-22 19:33:17+00:00,0.0,0
NFLX,"This investor bought Netflix, Alphabet and Nvidia on the cheap. Where he’s looking now.",2025-09-17 08:54:00+00:00,0.0,0
NFLX,Netflix (NASDAQ:NFLX) Upgraded at Loop Capital,2025-09-18 07:00:52+00:00,0.0,0
NFLX,Netflix (NASDAQ:NFLX) Trading Up 2.3% on Analyst Upgrade,2025-09-19 05:18:54+00:00,0.9986360669136047,0
NFLX,"Analysts Set Netflix, Inc. (NASDAQ:NFLX) Price Target at $1,317.58",2025-09-19 07:01:27+00:00,0.0,0
NFLX,"Stock Index Futures Muted After Record Rally, U.S. Confidence Data on Tap",2025-09-12 10:13:23+00:00,-0.9986633062362671,0
NFLX,"$20,000 invested in the Betashares Nasdaq 100 ETF (NDQ) 5 years ago is now worth",2025-09-25 20:54:20+00:00,0.0,0
NFLX,ITS launches Single Stock ETF on shares of seven leading U.S. companies,2025-09-04 06:05:00+00:00,0.0,0
NFLX,Purpose Investments Inc. Announces September 2025 Distributions,2025-09-18 00:00:00+00:00,0.0,0
