Ticker,title,Date,news_sentiment_score,positive_keywords_count
BRK-B,Fed Rate Cuts: Implications For Berkshire Hathaway’s Stock And Profits,2025-09-28 08:18:22+00:00,-0.9989398121833801,0
BRK-B,"Berkshire Hathaway Inc. (BRK-B) Ends Its 17-Year Stake in BYD, TD Cowen Reduces PT",2025-09-27 15:09:28+00:00,0.0,0
BRK-B,JIT-ing a stack machine (with SLJIT),2025-09-16 02:09:52+00:00,0.0,0
BRK-B,NVIDIA & Magnificent 7: Too Hot To Handle?,2025-08-31 11:00:00+00:00,-0.9999469518661499,0
BRK-B,Trump calls for earnings reports every 6 months so execs can 'focus on properly running their companies',2025-09-15 13:13:42+00:00,0.0,1
BRK-B,Warren Buffett Won’t Buy Anymore Berkshire Hathaway Stock Until It Hits This Price,2025-09-14 13:56:26+00:00,0.0,0
BRK-B,"Berkshire Hathaway Inc. (BRK-B) Ends Its 17-Year Stake in BYD, TD Cowen Reduces PT",2025-09-27 15:28:55+00:00,0.0,0
BRK-B,"Warren Buffett once explained how to turn $10,000 into $30 billion as a new investor — here are his 3 steps",2025-09-03 09:05:00+00:00,0.0,0
BRK-B,Is it a Good Time to Invest in Berkshire Hathaway (BRK-B) Shares?,2025-09-23 15:02:26+00:00,0.0,0
BRK-B,"Warren Buffett once explained how to turn $10,000 into $30 billion as a new investor — here are his 3 steps",2025-09-03 10:14:40+00:00,0.0,0
BRK-B,4 of Warren Buffett’s Favorite Dividend Stocks Posted Incredible Q2 Results,2025-09-12 21:08:29+00:00,0.9999852180480957,0
BRK-B,How Berkshire Hathaway crushed the S&P 500 — here's how 'less' can mean more for your portfolio,2025-09-20 09:09:00+00:00,0.0,0
BRK-B,"Berkshire Hathaway exits 17-year investment in China’s BYD, filing shows",2025-09-22 11:20:06+00:00,0.0,0
BRK-B,The Science Adventures of Tom and Huck (2025),2025-09-07 08:07:54+00:00,0.0,0
BRK-B,The Science Adventures of Tom and Huck (2025),2025-09-07 08:07:54+00:00,0.0,0
BRK-B,The Science Adventures of Tom and Huck (2025),2025-09-07 08:07:54+00:00,0.0,0
BRK-B,The Downfall of the German Dictatorship (2025),2025-09-14 06:42:19+00:00,-0.7803676128387451,0
BRK-B,Three Kilometres to the End of the World (2024),2025-09-24 04:04:14+00:00,0.0,0
BRK-B,"Vulnerability Summary for the Week of September 15, 2025",2025-09-22 17:14:41+00:00,0.0,0
BRK-B,Fundamental of Virtual Memory,2025-09-27 15:28:27+00:00,0.0,0
WMT,Tigress Financial Lifts Walmart (WMT) Price Target After Strong Q2 Results,2025-09-05 15:18:35+00:00,0.9999960660934448,0
WMT,"Walmart Inc. (WMT) Is Experiencing A Weird Tariff Perception, Says Jim Cramer",2025-08-31 13:56:35+00:00,0.0,0
WMT,Jim Cramer Says Walmart Inc. (WMT)’s One Of Three Major Retailers In The Industry,2025-09-10 08:02:51+00:00,0.0,0
WMT,Jim Cramer Says Walmart Inc. (WMT) Made A Mistake When Discussing Tariffs,2025-09-04 20:38:23+00:00,-0.9912416934967041,0
WMT,How Walmart’s (WMT) Scale and Efficiency Strengthen its Standing Among Retail Dividend Stocks,2025-09-25 23:49:52+00:00,1.0,0
WMT,Analyst Explains Why He Likes Walmart (WMT) Stock Amid Inflation Worries,2025-09-26 12:12:15+00:00,0.0,0
WMT,Tigress Financial Lifts Walmart (WMT) Price Target After Strong Q2 Results,2025-09-05 15:05:38+00:00,0.9999960660934448,0
WMT,Income for Life: 3 Dividend Stocks Crushing the S&P 500,2025-09-05 23:00:02+00:00,-0.9938173890113831,0
WMT,E-Commerce Growth and Consistent Dividends: Walmart (WMT)’s Strategy for the Future,2025-09-16 14:12:51+00:00,0.9999903440475464,0
WMT,What Walmart’s (WMT) Dividend Track Record Signals for NYSE Dividend Stocks,2025-09-21 15:17:58+00:00,0.0,0
WMT,Citi projects $1.9 trillion stablecoin boom by 2030,2025-09-25 15:22:24+00:00,0.0,0
WMT,Buenaventura (BVN) Announces Second Quarter 2025 Results,2025-09-12 07:51:47+00:00,0.0,0
WMT,Target Stock To $45?,2025-09-12 11:00:20+00:00,0.0,0
WMT,"Costco Stock: Buy, Sell, Or Hold?",2025-09-26 13:30:32+00:00,0.9618679285049438,0
WMT,Here's How Much You Would Have Made Owning Walmart Stock In The Last 20 Years,2025-09-17 20:36:10+00:00,0.0,0
WMT,Here's How Much $100 Invested In Walmart 10 Years Ago Would Be Worth Today,2025-09-04 22:33:40+00:00,0.0,0
WMT,"Costco stock sinks after US same-store sales miss forecasts as consumers weigh value push, tariff pressures",2025-09-24 20:14:23+00:00,-0.9999997615814209,0
WMT,'We haven't seen the worst of it': Retailers warn tariff impacts are far from over,2025-08-31 14:41:06+00:00,-0.9938302636146545,0
WMT,How Is Target's Stock Performance Compared to Other Retail Stocks?,2025-09-08 13:24:42+00:00,0.0,0
WMT,How To Be Irreplaceable During The AI Boom. Amazon Executive Says To Focus On This One Thing.,2025-09-25 16:31:07+00:00,0.0,0
WMT,How The 30 Famous Firms In The Dow Do—Or Don’t—Create Value,2025-09-15 03:32:41+00:00,0.0,0
WMT,How Walmart plans to prepare America's largest private workforce for an AI-driven future,2025-09-28 12:51:05+00:00,0.0,0
WMT,"Walmart launches essential service customers, members will cheer",2025-09-26 01:37:00+00:00,0.0,0
WMT,Smaller Discounts and Earlier Sales: What to Expect this Holiday Season,2025-09-20 09:00:00+00:00,0.0,0
WMT,"How Trump alarmed (and tried to calm) CEOs with his new $100,000 H-1B visa fee",2025-09-22 14:20:58+00:00,0.0,0
WMT,Salem Investment Counselors Inc. Sells 136 Shares of Walmart Inc. $WMT,2025-09-16 18:54:41+00:00,0.0,0
WMT,E-Commerce Growth and Consistent Dividends: Walmart (WMT)’s Strategy for the Future,2025-09-16 14:30:23+00:00,0.9999903440475464,0
WMT,"Elon Musk is still top dog, but Oracle’s Larry Ellison is now just $1 billion behind",2025-09-11 00:22:00+00:00,0.0,0
WMT,These are the top 22 stocks pushing the S&P 500 into record territory — and it’s not all Big Tech,2025-09-22 20:34:00+00:00,0.0,0
WMT,Jones Financial Companies Lllp Boosts Stock Position in Walmart Inc. $WMT,2025-09-15 07:46:50+00:00,1.0,0
WMT,Financiere des Professionnels Fonds d investissement inc. Buys New Holdings in Walmart Inc. $WMT,2025-09-20 08:32:50+00:00,0.0,0
WMT,What Walmart’s (WMT) Dividend Track Record Signals for NYSE Dividend Stocks,2025-09-21 15:37:12+00:00,0.0,0
WMT,Nvidia Is One Of 10 Stocks Analysts Insist Are Screaming Buys Now,2025-09-22 12:27:40+00:00,0.0,0
WMT,Walmart Chief Technology Officer Trades $3.10M In Company Stock,2025-09-17 15:12:20+00:00,0.0,0
WMT,Walmart sparks analysts' optimism about AI future,2025-09-18 18:21:51+00:00,0.9999988079071045,0
WMT,"Walton Family Holdings Trust Takes Money Off The Table, Sells $247.15M In Walmart Stock",2025-09-18 15:11:39+00:00,0.0,0
WMT,Walmart launches wild deals for all customers,2025-09-24 15:26:03+00:00,0.0,0
WMT,Piper Sandler Reaffirms “Overweight” Rating for Walmart (NYSE:WMT),2025-09-25 06:32:48+00:00,0.9999940395355225,0
WMT,Where Will Walmart Stock Be in 5 Years?,2025-09-01 14:20:55+00:00,0.0,0
WMT,Has its Sights on Amazon Prime Video as Streaming Wars Heats Up,2025-09-03 00:58:08+00:00,0.0,0
WMT,'We haven't seen the worst of it': Retailers warn tariff impacts are far from over,2025-08-31 14:47:59+00:00,-0.9938302636146545,0
WMT,What Is Going On With Walmart Stock On Friday?,2025-09-05 14:55:13+00:00,0.0,0
WMT,Walmart (NYSE:WMT) Price Target Raised to $125.00,2025-09-06 06:52:43+00:00,0.9999839067459106,0
WMT,Toy Stocks Worth Watching – September 19th,2025-09-21 07:42:56+00:00,0.0,0
WMT,Top Toy Stocks To Research – September 16th,2025-09-18 07:30:54+00:00,0.0,0
WMT,Best Apparel Stocks Worth Watching – September 19th,2025-09-22 07:02:52+00:00,0.0,0
WMT,Promising Toy Stocks To Watch Today – September 20th,2025-09-22 05:34:42+00:00,0.9998101592063904,0
WMT,Toy Stocks To Watch Today – August 30th,2025-09-01 06:04:43+00:00,0.0,0
WMT,Apparel Stocks To Consider – September 8th,2025-09-10 05:15:03+00:00,0.0,0
WMT,Home Improvement Stocks To Watch Now – September 12th,2025-09-14 07:02:45+00:00,0.0,0
WMT,Home Improvement Stocks To Follow Today – September 16th,2025-09-18 07:31:02+00:00,0.0,0
WMT,Best Home Improvement Stocks To Keep An Eye On – September 9th,2025-09-11 08:13:58+00:00,0.0,0
WMT,Top Toy Stocks To Follow Today – September 23rd,2025-09-25 07:40:51+00:00,0.0,0
WMT,Retail Stocks To Keep An Eye On – September 26th,2025-09-28 05:12:45+00:00,0.0,0
WMT,"The Federal Reserve Cuts Interest Rate by a Quarter-Percentage-Point, Signals 2 More Before the End of the Year",2025-09-17 15:27:26+00:00,0.0,0
WMT,Best Medical Stocks To Follow Now – August 31st,2025-09-02 06:03:14+00:00,0.0,0
WMT,Best Apparel Stocks To Watch Now – September 3rd,2025-09-05 05:42:53+00:00,0.0,0
WMT,Promising Medical Stocks To Research – September 5th,2025-09-07 06:32:47+00:00,0.0,0
WMT,Promising Grocery Stocks To Add to Your Watchlist – September 2nd,2025-09-04 08:32:55+00:00,0.6305878162384033,0
WMT,Best Medical Stocks To Watch Now – August 29th,2025-08-31 06:36:43+00:00,0.0,0
WMT,Broadcom Just Scored a Major OpenAI Win. Should You Buy AVGO Stock Here?,2025-09-11 16:04:39+00:00,0.9334821105003357,0
WMT,"Costco, Micron: A lot riding on earnings this week",2025-09-22 11:01:54+00:00,0.0,1
WMT,1 Safe Passive Income Stock Yielding Over 5% to Grab Now,2025-09-22 23:30:02+00:00,0.763045608997345,0
WMT,Is Affirm Stock the Next Fintech Growth Story?,2025-09-02 19:53:43+00:00,0.9994693398475647,0
WMT,Klarna (KLAR) IPO Update: Don’t Buy Now Or Later,2025-09-03 22:40:07+00:00,0.0,0
WMT,Apparel Stocks To Watch Today – September 17th,2025-09-20 07:07:07+00:00,0.0,0
WMT,Promising Toy Stocks To Follow Today – September 22nd,2025-09-24 07:00:51+00:00,0.9990298748016357,0
WMT,Top Apparel Stocks To Follow Today – September 23rd,2025-09-25 05:07:17+00:00,0.0,0
WMT,Apparel Stocks To Follow Now – September 11th,2025-09-14 07:02:45+00:00,0.0,0
WMT,Toy Stocks To Add to Your Watchlist – September 15th,2025-09-17 05:04:54+00:00,0.0,0
WMT,Promising Apparel Stocks To Research – September 7th,2025-09-10 08:43:19+00:00,0.0,0
WMT,Medical Stocks To Watch Now – September 21st,2025-09-23 05:07:02+00:00,0.0,0
WMT,Best Apparel Stocks To Follow Today – September 21st,2025-09-24 07:00:51+00:00,0.0,0
WMT,Apparel Stocks To Consider – September 12th,2025-09-15 07:40:59+00:00,0.0,0
WMT,Top Grocery Stocks To Consider – September 9th,2025-09-11 08:13:50+00:00,0.0,0
WMT,Apparel Stocks To Consider – September 20th,2025-09-23 07:06:57+00:00,0.0,0
WMT,Best Apparel Stocks To Consider – September 22nd,2025-09-24 05:36:42+00:00,0.0,0
WMT,Retail Stocks To Watch Now – September 24th,2025-09-26 05:01:37+00:00,0.0,0
WMT,Brokerages Set Walmart Inc. (NYSE:WMT) Price Target at $110.76,2025-09-08 05:32:49+00:00,0.0,0
WMT,Apparel Stocks To Follow Now – August 30th,2025-09-01 06:34:56+00:00,0.0,0
WMT,Top Apparel Stocks To Watch Now – August 29th,2025-09-01 08:24:58+00:00,0.0,0
WMT,Apparel Stocks To Follow Now – September 4th,2025-09-06 06:16:56+00:00,0.0,0
WMT,Best Home Improvement Stocks To Watch Now – September 17th,2025-09-19 07:02:52+00:00,0.0,0
WMT,Ecommerce Stocks To Follow Now – September 11th,2025-09-13 07:02:53+00:00,0.0,0
WMT,Top Outdoor Stocks To Research – September 7th,2025-09-09 06:34:54+00:00,0.0,0
WMT,Outdoor Stocks To Keep An Eye On – September 16th,2025-09-18 05:02:52+00:00,0.0,0
WMT,Ecommerce Stocks To Follow Today – September 23rd,2025-09-25 08:12:53+00:00,0.0,0
WMT,Outdoor Stocks To Follow Today – September 2nd,2025-09-04 06:04:59+00:00,0.0,0
WMT,Promising Video Game Stocks To Keep An Eye On – September 3rd,2025-09-05 07:50:55+00:00,0.9999982118606567,0
WMT,Video Game Stocks To Consider – August 31st,2025-09-02 08:04:52+00:00,0.0,0
WMT,Video Game Stocks Worth Watching – August 30th,2025-09-01 09:14:56+00:00,0.0,0
WMT,浮点数及其在 AI 中的应用 - Groot_Liu,2025-09-02 08:24:00+00:00,0.0,0
WMT,Best Grocery Stocks To Consider – September 17th,2025-09-19 07:02:48+00:00,0.0,0
WMT,Telsey Advisory Group Reaffirms “Outperform” Rating for Walmart (NYSE:WMT),2025-09-26 05:44:51+00:00,0.999962568283081,0
WMT,Top Medical Stocks To Follow Now – September 11th,2025-09-13 05:02:51+00:00,0.0,0
WMT,Best Medical Stocks To Keep An Eye On – September 10th,2025-09-12 05:08:43+00:00,0.8757141828536987,0
WMT,Home Improvement Stocks To Add to Your Watchlist – September 10th,2025-09-12 07:04:58+00:00,0.0,0
WMT,"These 5 stocks could be the big winners as retail bankruptcies pile up, UBS says",2025-09-19 14:49:27+00:00,0.9999979734420776,0
WMT,Wolfe Research Initiates Coverage on Walmart (NYSE:WMT),2025-09-20 06:22:50+00:00,0.0,0
WMT,Bank of America Raises Walmart (NYSE:WMT) Price Target to $125.00,2025-09-19 05:44:57+00:00,0.9995341300964355,0
LLY,"Trump's new tariffs on drugs, trucks and furniture: Top Story",2025-09-26 12:35:40+00:00,0.6416102647781372,0
LLY,Eli Lilly (LLY): Revisiting Valuation as Investors Reassess Outlook Without Major News,2025-09-01 10:08:28+00:00,0.0,0
LLY,Jefferies Sees Huge Potential in Eli Lilly’s (LLY) New Weight-Loss Pill,2025-09-05 15:18:41+00:00,1.0,0
LLY,Eli Lilly (LLY)’s Pharmaceutical Leadership as a Driver of Consistent Dividends,2025-09-16 14:25:05+00:00,1.0,0
LLY,Alzheimer’s Drug Franchise Decides Eli Lilly And Co.’s (LLY) Performance,2025-09-22 12:38:24+00:00,0.0,0
LLY,"HSBC Upgrades Eli Lilly (LLY) to Hold, Lifts Price Target to $700",2025-08-31 04:16:46+00:00,0.9999961853027344,0
LLY,BMO Capital Affirms Eli Lilly (LLY)’s ‘Outperform’ Rating on Weight Loss Drug Prospects,2025-09-02 15:13:35+00:00,0.9999997615814209,0
LLY,Jim Cramer Urges Patience With Eli Lilly and Company (LLY)’s Stock,2025-09-03 16:12:19+00:00,0.0,0
LLY,Eli Lilly and Company (LLY) Unveils $5B Virginia Facility to Ramp Up Bioconjugate and Monoclonal Antibody Production,2025-09-23 23:01:44+00:00,0.0,0
LLY,Here’s What Dragged Eli Lilly and Company (LLY) Down in Q2,2025-09-25 14:02:38+00:00,-0.9609085917472839,0
LLY,UBS Sees $15 Billion Sales Potential for Eli Lilly’s (LLY) Obesity Treatment Orforglipron,2025-09-10 03:56:00+00:00,0.0,0
LLY,Pharma Giant Eli Lilly (LLY) Could Still Be a Screaming Deal—Here’s the Statistical Evidence,2025-09-15 17:30:02+00:00,0.0,0
LLY,"Novo Nordisk Cuts Around 9,000 Jobs as Weight-Loss Drugmaker Faces Growing Competition",2025-09-10 15:06:50+00:00,-0.9998393058776855,0
LLY,"Citi Maintains a Buy Rating on Eli Lilly and Company (LLY), Retains the $1,190 PT",2025-09-16 18:58:07+00:00,0.9999992847442627,0
LLY,Pfizer's 6.9% Yield & Bullish Signal: A Prime Buying Opportunity?,2025-09-04 19:00:00+00:00,0.9999997615814209,0
LLY,Jefferies Sees Huge Potential in Eli Lilly’s (LLY) New Weight-Loss Pill,2025-09-05 15:05:34+00:00,1.0,0
LLY,Bank of America Reiterates Eli Lilly (LLY) Buy on GLP-1 Growth Momentum,2025-09-16 17:34:23+00:00,1.0,0
LLY,Eli Lilly and Company (LLY) Diabetes Medication Successful in Children and Adolescents,2025-09-18 16:40:05+00:00,0.0,0
LLY,Jim Cramer Explains Why Eli Lilly May Not Be Next to Hit $1 Trillion,2025-09-20 04:45:00+00:00,0.0,0
LLY,Eli Lilly and Company (LLY) Unveils AI Platform to Enhance Drug Discovery,2025-09-15 13:03:35+00:00,0.9997307658195496,0
LLY,Eli Lilly (LLY) Plans $5 Billion Virginia Facility to Boost Monoclonal Antibody Production,2025-09-21 08:11:29+00:00,0.9972718358039856,0
LLY,eCIO Initiates Stake in Eli Lilly and Company (LLY) with 886 Shares,2025-09-18 14:57:32+00:00,0.0,0
LLY,Eli Lilly launches platform for AI-enabled drug discovery,2025-09-09 11:09:09+00:00,0.0,0
LLY,Executives Remain Skittish About Buying Their Own Shares,2025-09-15 13:15:00+00:00,0.0,0
LLY,Johnson & Johnson: JNJ Stock To $250?,2025-09-09 14:00:43+00:00,0.0,0
LLY,Why This Insurer’s $30-Billion Move Is Good For Aberdeen’s CEFs,2025-09-20 13:43:00+00:00,0.9999994039535522,0
LLY,"Novo Nordisk's Wegovy Outshines Eli Lilly's Tirzepatide In Reducing Risk Of Heart Attack, Stroke And Death",2025-09-02 13:05:47+00:00,0.0,0
LLY,Agilent Technologies Stock: Is A Underperforming the Healthcare Sector?,2025-09-11 18:19:29+00:00,-0.9995680451393127,0
LLY,"Wells Fargo Reiterates Buy Rating on Eli Lilly and Company Stock, Maintains PT at $1,000",2025-09-26 14:59:46+00:00,0.9999991655349731,0
LLY,Looking for the Next Big Pop? Here’s Why Recursion Pharmaceuticals (RXRX) Could Do a Dead-Cat Bounce,2025-09-25 13:15:01+00:00,0.0,0
LLY,"25,000 Shares in Direxion Daily LLY Bear 1X Shares $ELIS Acquired by Goldman Sachs Group Inc.",2025-09-25 07:34:56+00:00,0.0,0
LLY,"Leverage Shares Launches First 3x Single-Stock ETPs on HOOD, HIMS, UNH and Others",2025-09-16 18:01:54+00:00,0.0,0
LLY,Novo Nordisk: A Guru Buy Amid the Selloff -- Do LEAPS Make Sense?,2025-09-21 21:12:11+00:00,0.9998286962509155,0
LLY,Zacks Research Has Pessimistic Outlook of LLY Q4 Earnings,2025-09-01 05:31:04+00:00,-0.9999817609786987,0
LLY,Large-cap biotech is a sector to watch for investors: Analysts,2025-08-31 12:40:00+00:00,0.0,0
LLY,Here's How Much $100 Invested In Eli Lilly 15 Years Ago Would Be Worth Today,2025-09-12 16:50:19+00:00,0.0,0
LLY,FDA Approves Eli Lilly's Drug For Advanced Breast Cancer,2025-09-26 13:20:54+00:00,0.0,0
LLY,Rival Novo Nordisk’s Stock Pops in Europe on Wegovy Data,2025-09-01 21:26:50+00:00,0.0,0
LLY,This House of Representative Just Bought Up To $245K In Eli Lilly Stock,2025-09-03 15:03:34+00:00,0.0,0
LLY,Eli Lilly announces plans for $6.5B manufacturing plant in Houston,2025-09-23 19:53:32+00:00,0.0,0
LLY,Eli Lilly Ends Bimagrumab Obesity Study Weeks After Launch,2025-09-25 15:37:59+00:00,0.0,0
LLY,Eli Lilly Stock Is Trading Down Thursday: What's Behind The Move?,2025-09-25 19:32:32+00:00,0.0,0
LLY,Eli Lilly and Company (LLY) Unveils AI Platform to Enhance Drug Discovery,2025-09-15 13:21:03+00:00,0.9997307658195496,0
LLY,Bank of America Reiterates Eli Lilly (LLY) Buy on GLP-1 Growth Momentum,2025-09-16 17:49:55+00:00,1.0,0
LLY,Eli Lilly and Company (LLY) Diabetes Medication Successful in Children and Adolescents,2025-09-18 16:52:58+00:00,0.0,0
LLY,BMO Capital Affirms Eli Lilly (LLY)’s ‘Outperform’ Rating on Weight Loss Drug Prospects,2025-09-02 15:29:44+00:00,0.9999997615814209,0
LLY,"Insiders Bought the Selloff in Eli Lilly. Should You Buy LLY Stock, Too?",2025-09-02 19:22:50+00:00,0.0,0
LLY,Jim Cramer Urges Patience With Eli Lilly and Company (LLY)’s Stock,2025-09-03 16:32:56+00:00,0.0,0
LLY,Eli Lilly and Company $LLY Shares Sold by First Hawaiian Bank,2025-09-16 08:12:58+00:00,0.0,0
LLY,Pharma Giant Eli Lilly (LLY) Could Still Be a Screaming Deal—Here’s the Statistical Evidence,2025-09-15 17:37:45+00:00,0.0,0
LLY,"Wells Fargo Reiterates Buy Rating on Eli Lilly and Company Stock, Maintains PT at $1,000",2025-09-26 15:13:09+00:00,0.9999991655349731,0
LLY,Eli Lilly and Company $LLY Shares Bought by Salem Investment Counselors Inc.,2025-09-16 19:24:42+00:00,0.0,0
LLY,eCIO Initiates Stake in Eli Lilly and Company (LLY) with 886 Shares,2025-09-18 15:22:39+00:00,0.0,0
LLY,Eli Lilly and Company’s (LLY) Hold Rating Reiterated at Berenberg Bank,2025-09-18 07:42:48+00:00,0.0,0
LLY,Here’s What Dragged Eli Lilly and Company (LLY) Down in Q2,2025-09-25 14:20:16+00:00,-0.9609085917472839,0
LLY,Alzheimer’s Drug Franchise Decides Eli Lilly And Co.’s (LLY) Performance,2025-09-22 13:01:08+00:00,0.0,0
LLY,Medical Stocks To Consider – September 8th,2025-09-10 05:14:59+00:00,0.0,0
LLY,Pharmaceutical Stocks To Consider – September 12th,2025-09-14 05:02:52+00:00,0.0,0
LLY,Defiance Launches LLYZ: The First 2X Short ETF for Eli Lilly,2025-09-03 13:30:00+00:00,0.0,0
LLY,Best Medical Stocks To Watch Now – August 29th,2025-08-31 06:36:43+00:00,0.0,0
LLY,Best Medical Stocks To Follow Now – August 31st,2025-09-02 06:03:14+00:00,0.0,0
LLY,Promising Medical Stocks To Research – September 5th,2025-09-07 06:32:47+00:00,0.0,0
LLY,Best Medical Stocks To Research – September 7th,2025-09-09 06:34:49+00:00,0.0,0
LLY,Medical Stocks To Watch Today – September 13th,2025-09-15 05:03:01+00:00,0.0,0
LLY,Best Pharmaceutical Stocks To Consider – September 11th,2025-09-13 05:02:51+00:00,0.0,0
LLY,JPMorgan Chase & Co. Has Lowered Expectations for Eli Lilly and Company (NYSE:LLY) Stock Price,2025-09-18 05:56:56+00:00,-0.9999990463256836,0
LLY,Top Pharmaceutical Stocks To Consider – September 17th,2025-09-19 05:02:57+00:00,0.0,0
LLY,Best Medical Stocks To Keep An Eye On – September 10th,2025-09-12 05:08:43+00:00,0.8757141828536987,0
LLY,Top Pharmaceutical Stocks To Research – September 8th,2025-09-10 05:15:01+00:00,0.0,0
LLY,Best Pharmaceutical Stocks To Add to Your Watchlist – September 20th,2025-09-22 05:03:02+00:00,0.0,0
LLY,Promising Pharmaceutical Stocks To Follow Now – September 15th,2025-09-17 05:05:01+00:00,0.7279217839241028,0
LLY,Medical Stocks To Watch Now – September 21st,2025-09-23 05:07:02+00:00,0.0,0
LLY,Sen. John Boozman Buys Eli Lilly and Company (NYSE:LLY) Stock,2025-09-15 06:12:42+00:00,0.0,0
LLY,Roche targets becoming top 3 obesity player as experimental drug enters late-stage trial,2025-09-25 06:01:18+00:00,0.74948650598526,0
LLY,Wall Street Zen Downgrades Eli Lilly and Company (NYSE:LLY) to Buy,2025-09-21 07:55:03+00:00,0.5057120323181152,0
LLY,Pharmaceutical Stocks To Keep An Eye On – August 30th,2025-09-01 06:04:44+00:00,0.0,0
LLY,Eli Lilly and Company (NYSE:LLY) Upgraded at Wall Street Zen,2025-08-31 07:58:55+00:00,0.8419846296310425,0
LLY,Eli Lilly and Company (NYSE:LLY) Given Average Recommendation of “Moderate Buy” by Analysts,2025-09-08 06:22:44+00:00,0.0,0
LLY,Eli Lilly and Company - 716475 - 09/09/2025,2025-09-16 14:43:17+00:00,0.0,0
LLY,Eli Lilly and Company (NYSE:LLY) Stock Acquired Rep. David Taylor,2025-09-04 07:10:57+00:00,0.0,0
LLY,Sen. John Boozman Buys Eli Lilly and Company (NYSE:LLY) Stock,2025-09-18 06:40:42+00:00,0.0,0
LLY,Eli Lilly and Company - 716462 - 09/09/2025,2025-09-16 15:31:03+00:00,0.0,0
LLY,Eli Lilly and Company - 716485 - 09/09/2025,2025-09-16 14:43:15+00:00,0.0,0
LLY,"Eli Lilly is coming to Houston, bringing thousands of jobs",2025-09-23 17:47:58+00:00,0.0,0
LLY,"""Phyna's Greed Killed Her Sister"": VDM Strikes Back, Gives Update On Dangote's Operations in Edo",2025-09-02 15:38:55+00:00,0.0,0
LLY,edmlib added to PyPI,2025-09-22 15:39:53+00:00,0.0,0
JPM,JPMorgan Chase & Co. (JPM): A Bull Case Theory,2025-09-19 17:24:55+00:00,0.0,0
JPM,JPM postpones ECB rate cut forecast to December after policy meeting,2025-09-12 08:35:33+00:00,0.0,0
JPM,JPMorgan Chase & Co (JPM) Hires More Tech Experts to Strengthen M&A Business,2025-09-02 15:13:25+00:00,0.9845372438430786,0
JPM,JPMorgan Chase’s Profit Engine That Remains Undervalued,2025-09-10 13:57:41+00:00,0.9999998807907104,0
JPM,JPMorgan’s (JPM) Dividend Strategy: A Key to Its Best Performing in 2025 Status,2025-09-18 19:32:23+00:00,0.9999983310699463,0
JPM,One Everyday Tool That’s Easy to Overlook,2025-09-18 14:57:02+00:00,0.0,0
JPM,JPMorgan Chase (JPM): A Cornerstone Pick Among the Best Bank Dividend Stocks,2025-09-28 01:54:23+00:00,1.0,0
JPM,Bitcoin Network Hashrate Returned to All-Time Highs in August: JPMorgan,2025-09-02 14:17:52+00:00,0.9736623167991638,0
JPM,This Blue-Chip Dividend Stock Just Raised Its Payout by 7%. Should You Buy Shares Here?,2025-09-20 13:00:02+00:00,0.9767024517059326,0
JPM,JPMorgan (JPM) to Pay Malaysia $330 Million in 1MDB Settlement,2025-09-04 19:01:31+00:00,0.0,0
JPM,Jim Cramer Says Wells Fargo “Is the Best Position to Go Higher”,2025-09-24 08:28:33+00:00,0.9999997615814209,0
JPM,"Jim Cramer Thinks Tesla, Inc. (TSLA) Might See Better Numbers",2025-09-20 19:06:24+00:00,0.9945884943008423,0
JPM,JPMorgan Just Issued a Warning for MicroStrategy and Other Crypto Treasury Stocks. How Should You Play Them Here?,2025-09-11 20:01:17+00:00,0.0,0
JPM,Strategy's S&P 500 Snub is a Cautionary Signal for Corporate Bitcoin Treasuries: JPMorgan,2025-09-11 11:58:49+00:00,0.0,0
JPM,What to Expect From JPMorgan Chase's Next Quarterly Earnings Report,2025-09-26 06:08:15+00:00,0.0,0
JPM,"JPM, Fifth Third Among Banks Facing Tricolor Losses",2025-09-10 13:49:28+00:00,-0.9998726844787598,0
JPM,Jim Cramer Praises JPMorgan Chase & Co. (JPM)’s Work Culture,2025-09-15 14:54:32+00:00,0.0,0
JPM,"Amazon (AMZN) Maintains Lead in US E-Commerce Retail, per JPM",2025-09-04 19:05:34+00:00,0.9999812841415405,0
JPM,Analysis-Financial firms to feel outsized impact from Trump's H-1B overhaul,2025-09-24 10:06:32+00:00,0.9862952828407288,0
JPM,Wall Street Strategists See Stock Rally Stalling on Fed Rate Cut,2025-09-15 10:05:18+00:00,-0.9999926090240479,0
JPM,Is JPMorgan Chase & Co. (JPM) the Safest Bet Among NYSE Dividend Stocks?,2025-09-21 15:21:48+00:00,0.9999948740005493,0
JPM,"RM1.99 RON95 starts on Sept 30 for all Malaysians, PDRM/ATM Sept 27, STR recipients Sept 28 – PMX",2025-09-22 01:34:24+00:00,0.0,0
JPM,"JPMorgan Chase & Co. (JPM) Is Not Trading At Where It Should, Implies Jim Cramer",2025-09-12 19:06:12+00:00,0.0,0
JPM,"KBW Reaffirms JPMorgan (JPM) Outperform, Citing Earnings Momentum and Scale Advantages",2025-09-16 17:34:21+00:00,1.0,0
JPM,"JPMorgan (JPM) Leads Global Payments Market, Says Morgan Stanley After Executive Meeting",2025-09-21 08:11:26+00:00,0.0,0
JPM,JPMorgan's Jamie Dimon Says Economy Is 'Weakening' as Execs Sound Off Ahead of Fed Meeting,2025-09-11 20:56:48+00:00,-0.999992847442627,0
JPM,PNC to buy Colorado bank for $4.1 billion as part of coast-to-coast push,2025-09-08 13:58:06+00:00,0.0,0
JPM,Wall Street Pros Race to Lift S&P 500 Targets After Record Rally,2025-09-10 09:21:33+00:00,0.9999688863754272,0
JPM,iCaur 03 EV – world’s first delivery of electric off-road SUV is to car collector JP Chin at iCaur Petaling Jaya,2025-09-11 03:48:10+00:00,0.0,0
JPM,Wall Street launches coverage of Firefly Aerospace with mixed views,2025-09-02 17:09:03+00:00,-0.8385688066482544,0
JPM,"BlackRock-led group in talks to raise around $10.3 billion for Aramco deal, sources say",2025-09-10 14:43:41+00:00,0.0,0
JPM,J.P. Morgan Doubles Down on 2 Healthcare Facility Stocks,2025-09-26 10:05:26+00:00,0.0,0
JPM,$1000 Invested In This Stock 10 Years Ago Would Be Worth This Much Today,2025-09-08 23:33:14+00:00,0.0,0
JPM,Warning: This 8% Dividend Pick Will Be Controversial,2025-09-27 12:10:00+00:00,-0.999998927116394,0
