Ticker,title,Date,news_sentiment_score,positive_keywords_count
TMUS,Is T-Mobile US Stock Outperforming the S&P 500?,2025-09-01 12:15:21+00:00,0.9996071457862854,0
TMUS,"T-Mobile (TMUS) Completes UScellular Merger, Eyes $1.2 Billion Annual Cost Savings",2025-09-21 07:59:32+00:00,0.9436285495758057,0
TMUS,Verizon CEO says SpaceX's $17 billion 5G deal will be 'complementary' to business,2025-09-08 21:09:07+00:00,0.0,0
TMUS,T-Mobile expects $400 million service revenue boost in Q3 from UScellular deal,2025-09-04 14:10:38+00:00,1.0,0
TMUS,AT&T CEO on economy: There's stress in some consumer segments,2025-09-09 20:30:23+00:00,-0.9999973773956299,0
TMUS,Advisors Rethink Cash Ahead of Rate Cuts,2025-09-14 12:00:00+00:00,0.0,0
TMUS,"Stock market today: Dow, S&P 500, Nasdaq futures pull back from records as gold powers to fresh high",2025-09-21 23:44:23+00:00,0.0,0
TMUS,Jim Cramer Notes T-Mobile’s Valuation Alongside Earnings Growth Forecast,2025-09-25 17:05:21+00:00,0.0,0
TMUS,Flashing XT BIOS on AMD Radeon RX 9070 Yields up to 25% Performance Boost,2025-09-21 09:27:41+00:00,1.0,0
TMUS,tmus 0.3.0,2025-09-07 19:07:46+00:00,0.0,0
TMUS,T-Mobile Sees Quicker Payoff In UScellular Takeover With Higher Synergies,2025-09-04 13:41:49+00:00,0.9999997615814209,0
TMUS,tmus 0.5.1,2025-09-15 02:12:39+00:00,0.0,0
TMUS,Here's How Much You Would Have Made Owning T-Mobile US Stock In The Last 5 Years,2025-09-26 15:00:46+00:00,0.0,0
TMUS,"Top Stock Movers Now: EchoStar, Robinhood, T-Mobile, and More",2025-09-08 15:32:34+00:00,0.0,0
TMUS,Here’s Why T-Mobile (TMUS) Slid 10% in Q2,2025-09-23 14:51:29+00:00,-0.4842839539051056,0
TMUS,Jim Cramer shines light on top stocks to target now,2025-09-24 19:13:00+00:00,-0.555509626865387,0
TMUS,Stocks Settle Higher as Bond Yields Fall and Chip Makers Climb,2025-09-08 20:28:00+00:00,0.9951688647270203,0
TMUS,T-Mobile's new CEO Srini Gopalan faces pressure to fend off rivals,2025-09-22 16:33:37+00:00,-0.999998927116394,0
TMUS,Here's How Much $100 Invested In T-Mobile US 10 Years Ago Would Be Worth Today,2025-09-09 14:23:04+00:00,0.0,0
TMUS,"Stock market today: Dow, S&P 500, Nasdaq pull back from records as gold powers to fresh high",2025-09-21 23:44:23+00:00,0.0,0
TMUS,"Perpetual Ltd Trims Stock Holdings in T-Mobile US, Inc. $TMUS",2025-09-22 08:00:52+00:00,0.0,0
TMUS,"T-Mobile US, Inc. (TMUS) Is Key To New iPhone Deals, Says Jim Cramer",2025-09-10 17:57:08+00:00,0.0,0
TMUS,"Jones Financial Companies Lllp Has $1.61 Million Position in T-Mobile US, Inc. $TMUS",2025-09-12 08:10:50+00:00,0.0,0
TMUS,"Integrated Wealth Concepts LLC Sells 349 Shares of T-Mobile US, Inc. $TMUS",2025-09-11 09:05:03+00:00,0.0,0
TMUS,T-Mobile suffers massive boycott from customers,2025-09-11 15:03:54+00:00,-0.9999967813491821,0
TMUS,T-Mobile's new CEO Srini Gopalan faces pressure to fend off rivals,2025-09-22 16:45:20+00:00,-0.999998927116394,0
TMUS,T-Mobile plans a harsh change for customers after new CEO starts,2025-09-24 12:16:33+00:00,0.0,0
TMUS,"Modern Wealth Management LLC Has $1.05 Million Stake in T-Mobile US, Inc. $TMUS",2025-09-14 07:47:02+00:00,0.0,0
TMUS,"T-Mobile US, Inc. (TMUS) Stakeholder Deutsche Telekom Offloads 136K Shares",2025-09-18 15:23:11+00:00,0.0,0
TMUS,"NorthCrest Asset Manangement LLC Invests $284,000 in T-Mobile US, Inc. $TMUS",2025-09-22 11:34:49+00:00,0.0,0
TMUS,"Farther Finance Advisors LLC Purchases 3,701 Shares of T-Mobile US, Inc. $TMUS",2025-09-23 08:13:04+00:00,0.0,0
TMUS,T-Mobile Seen Adding Millions Of New Customers Each Year Despite Sluggish Economy,2025-09-23 16:19:31+00:00,0.9654927849769592,0
TMUS,10 Stocks and ETFs That Could Be Good for the Middle Class,2025-09-22 19:17:09+00:00,0.999332845211029,0
TMUS,"Stock market today: Dow, S&P 500, Nasdaq turn higher as Nvidia surges on OpenAI deal",2025-09-21 23:44:23+00:00,0.9999973773956299,0
TMUS,Jewish law prof loses bid to quash TMU's decision not to discipline students who signed 'antisemitic' letter,2025-09-18 18:57:46+00:00,-0.8879008293151855,0
TMUS,"Telekom Ag Deutsche Sells 69,840 Shares of T-Mobile US (NASDAQ:TMUS) Stock",2025-08-31 08:16:52+00:00,0.0,0
TMUS,"Stock market today: Dow, S&P 500, Nasdaq hit 3rd record in a row as Nvidia soars on OpenAI deal",2025-09-22 20:00:11+00:00,0.9268791675567627,0
TMUS,T-Mobile US (NASDAQ:TMUS) Coverage Initiated at The Goldman Sachs Group,2025-09-04 07:10:59+00:00,0.0,0
TMUS,"T-Mobile US, Inc. (NASDAQ:TMUS) Receives $256.31 Average Price Target from Brokerages",2025-09-05 07:30:45+00:00,0.0,0
TMUS,"Stock market today: Dow, S&P 500, Nasdaq turn higher as gold powers to fresh high",2025-09-21 23:44:23+00:00,0.999996542930603,0
TMUS,Stocks Mostly Higher on Fed Easing Prospects,2025-09-08 14:08:09+00:00,0.9999984502792358,0
TMUS,Stocks Supported by Hopes of Fed Rate Cuts,2025-09-08 15:11:27+00:00,0.0,0
TMUS,3Dfx Voodoo modded with 12 MB of RAM and two texture mappers — reveals how revolutionary GPU was way ahead of its time,2025-09-27 10:30:00+00:00,0.0,0
TMUS,"T-Mobile US, Inc. (NASDAQ:TMUS) Given Consensus Rating of “Moderate Buy” by Brokerages",2025-09-27 06:56:49+00:00,0.0,0
TMUS,Global Artificial Intelligence Fintech Market Expected to Reach $76 Billion By 2033 as AI Adoption in the Financial Industry Expands,2025-09-24 13:20:00+00:00,0.999992847442627,0
TMUS,Nvidia's unreleased 'GTX 2080 Ti' surfaces online with 12 GB VRAM and 384-bit memory bus — engineering sample has better specs than the final retail 'RTX' version,2025-09-16 12:42:38+00:00,1.0,0
TMUS,US stock market surges today: Nasdaq and S&P 500 hit record highs; Dow flat – Wall Street on the move as Robinhood and AppLovin stocks soar,2025-09-08 15:32:50+00:00,0.9984488487243652,0
TMUS,"AMD silently launches RX 7700 non-XT with 16 GB VRAM — New RDNA 3 GPU uses nerfed Navi 32 die, offers reduced performance and increased power draw",2025-09-19 15:27:45+00:00,0.6366225481033325,0
TMUS,ASRock Unveils The First Radeon RX 7700 GPU While AMD Officially Adds Support Via Latest GPU Driver,2025-09-19 12:26:23+00:00,0.9139666557312012,0
TMUS,Former Rogers CEO Nadir Mohamed was a bridge between corporate Canada and the startup world - The Logic,2025-09-19 20:15:29+00:00,0.0,0
CVX,3 Dividend Stocks To Consider With Up To 7.5% Yield,2025-09-09 11:32:28+00:00,0.0,0
CVX,How Is Chevron's Stock Performance Compared to Other Oil & Gas Exploration & Production Stocks?,2025-09-01 13:37:31+00:00,0.0,0
CVX,Chevron Corporation (CVX) – A Great Option for Your Dividend Stock Portfolio,2025-09-24 02:07:00+00:00,0.0,0
CVX,Chevron Corporation (CVX): A Reliable Energy Giant for Dividend Paying Stocks Investors,2025-09-21 03:00:37+00:00,0.9999996423721313,0
CVX,Chevron Corporation (CVX) Expands Eastern Mediterranean Reach with Greek Offshore Gas Bid,2025-09-28 22:52:49+00:00,0.9999550580978394,0
CVX,Chevron Corporation (CVX) Announces the Submission of Its Bid to Explore Natural Gas in Four Offshore Blocks in Greece,2025-09-22 21:38:55+00:00,0.0,0
CVX,Here’s Why Chevron (CVX) Traded Lower in Q2,2025-09-01 12:43:20+00:00,-0.9994677901268005,0
CVX,What's Next For BP Stock?,2025-09-16 11:00:04+00:00,0.0,0
CVX,Jim Cramer on Chevron: “It’s Just a Hold”,2025-09-25 17:12:45+00:00,-0.569157063961029,0
CVX,How The 30 Famous Firms In The Dow Do—Or Don’t—Create Value,2025-09-15 03:32:41+00:00,0.0,0
CVX,Chevron Corporation $CVX Shares Purchased by Bayforest Capital Ltd,2025-09-14 07:20:59+00:00,0.0,0
CVX,"Balefire LLC Acquires 3,511 Shares of Chevron Corporation $CVX",2025-09-18 08:28:57+00:00,0.0,0
CVX,Here’s Why Chevron (CVX) Traded Lower in Q2,2025-09-01 12:50:13+00:00,-0.9994677901268005,0
CVX,Salem Investment Counselors Inc. Purchases 102 Shares of Chevron Corporation $CVX,2025-09-16 17:21:16+00:00,0.0,0
CVX,Big Tech's AI ambitions are straining the US power grid. Natural gas might be its answer.,2025-09-24 08:00:40+00:00,-0.999788224697113,0
CVX,"Intel downgraded, Tesla upgraded: Wall Street's top analyst calls",2025-09-19 13:39:34+00:00,-0.9997792840003967,0
CVX,Here's How Much $100 Invested In Chevron 5 Years Ago Would Be Worth Today,2025-09-22 16:22:32+00:00,0.0,0
CVX,Stocks Settle Slightly Lower as Markets Await the Fed,2025-09-16 20:39:19+00:00,0.0,0
CVX,1 Reason I Can't Stop Thinking About Chevron Stock in 2025,2025-09-22 10:24:32+00:00,0.0,0
CVX,Mizuho Cuts Chevron (NYSE:CVX) Price Target to $191.00,2025-09-16 06:58:45+00:00,-0.859523594379425,0
CVX,Jones Financial Companies Lllp Has $115.89 Million Holdings in Chevron Corporation $CVX,2025-09-14 15:27:27+00:00,0.0,0
CVX,"Stock market today: Dow, S&P 500, Nasdaq edge up after US jobs data is revised sharply down",2025-09-09 13:36:38+00:00,0.0,0
CVX,Stocks Turn Lower as 2-Day FOMC Meeting Begins,2025-09-16 15:19:25+00:00,-0.986158549785614,0
CVX,Oil Stocks To Follow Now – September 6th,2025-09-08 06:40:45+00:00,0.0,0
CVX,Top Oil Stocks Worth Watching – September 19th,2025-09-21 05:46:43+00:00,0.0,0
CVX,Best Dividend Stocks To Add to Your Watchlist – September 16th,2025-09-18 07:31:01+00:00,0.0,0
CVX,Top Energy Stocks To Add to Your Watchlist – September 7th,2025-09-10 08:04:59+00:00,0.0,0
CVX,"This investor bought Netflix, Alphabet and Nvidia on the cheap. Where he’s looking now.",2025-09-17 08:54:00+00:00,0.0,0
CVX,Dividend Stocks To Follow Today – August 30th,2025-09-01 08:30:53+00:00,0.0,0
CVX,Promising Oil Stocks To Follow Now – September 10th,2025-09-12 05:08:43+00:00,0.9728007912635803,0
CVX,Should You Invest Like Michael Burry and Buy This New IPO Stock Here?,2025-09-17 20:06:09+00:00,0.0,0
CVX,ドジャース・ラッシングが自打球で負傷交代…,2025-09-06 01:14:48+00:00,0.0,0
CVX,Top Energy Stocks To Add to Your Watchlist – September 26th,2025-09-28 05:12:47+00:00,0.0,0
CVX,Oil Stocks To Follow Now – September 1st,2025-09-03 05:16:43+00:00,0.0,0
CVX,Best Energy Stocks To Research – September 1st,2025-09-03 05:16:44+00:00,0.0,0
CVX,Promising Oil Stocks To Watch Today – August 29th,2025-08-31 06:04:43+00:00,0.0,0
CVX,Energy Stocks Worth Watching – August 30th,2025-09-02 08:04:51+00:00,0.0,0
CVX,Top Energy Stocks To Research – August 31st,2025-09-03 07:02:52+00:00,0.0,0
CVX,Promising Industrial Stocks To Follow Today – September 2nd,2025-09-04 06:04:55+00:00,0.9922921657562256,0
CVX,Oil Stocks To Follow Now – September 5th,2025-09-07 07:04:52+00:00,0.0,0
CVX,Oil Stocks To Watch Now – September 14th,2025-09-16 05:02:51+00:00,0.0,0
CVX,Stocks Pressured as Bond Yields Rise,2025-09-24 15:20:36+00:00,-0.999931812286377,0
CVX,Stocks Retreat on Higher Bond Yields,2025-09-24 20:45:01+00:00,-0.9552052617073059,0
CVX,Stocks See Support from Strength in Chip Makers and AI Optimism,2025-09-24 14:09:47+00:00,1.0,0
CVX,Stocks Fade on Economic Concerns after Weak US Unemployment Report,2025-09-05 20:57:26+00:00,-0.9998946189880371,0
CVX,"Stock market today: Dow, S&P 500, Nasdaq climb to records as sharp jobs revision sets stage for inflation data",2025-09-09 20:00:28+00:00,0.0,0
CVX,Analysts Set Chevron Corporation (NYSE:CVX) Price Target at $163.95,2025-09-11 06:11:00+00:00,0.0,0
CVX,Chevron Is Poised To Be An Energy Leader (Upgrade),2025-09-22 00:37:39+00:00,1.0,0
CVX,Promising Industrial Stocks To Follow Today – September 1st,2025-09-03 05:16:44+00:00,0.987280547618866,0
CVX,Chevron (NYSE:CVX) Stock Price Up 1% After Analyst Upgrade,2025-09-12 05:22:44+00:00,0.9999809265136719,0
CVX,Stocks and Bonds Climb as Weak Jobs Bolster Fed Rate Cut Chances,2025-09-03 15:16:42+00:00,0.999362051486969,0
CVX,Stocks Supported as Chances Improve for a Fed Rate Cut,2025-09-03 20:46:38+00:00,0.99982750415802,0
CVX,"Chevron (NYSE:CVX) Stock Price Expected to Rise, Bank of America Analyst Says",2025-09-12 06:16:53+00:00,0.9205648899078369,0
CVX,"US stock market today reverse gains: Dow, S&P 500 and Nasdaq pull back from record highs as retail sales surge and Fed rate decision looms",2025-09-16 15:31:29+00:00,0.8588290810585022,0
CVX,Comparative microfluidic and enzymatic analyses reveal multifaceted snake venom resistance and novel VWF behavior in the opossum Monodelphis domestica,2025-09-19 14:00:00+00:00,0.0,0
CVX,Sudan’s Oil Corridor Under Threat as Militia Attacks Escalate,2025-09-19 13:00:00+00:00,-0.9982684850692749,0
MRK,Leerink Partners Maintained a Buy on Merck & Co (MRK),2025-09-07 14:23:49+00:00,0.9995077848434448,0
MRK,Leerink Partners Remains Bullish on Merck & Co. (MRK),2025-09-14 05:17:04+00:00,1.0,0
MRK,Resilience in Healthcare: How Merck (MRK) Maintains Consistent Dividends Through Market Uncertainty,2025-09-16 14:19:58+00:00,0.9998884201049805,0
MRK,Dividend Stability and Market Reach: Merck & Co (MRK) Among Top Dividend Stocks to Buy Under $100,2025-09-20 00:58:50+00:00,1.0,0
MRK,Merck & Co. (MRK) Announces First Patient Dosage in HERTHENA-Breast04 Phase 3 Trial,2025-08-31 04:10:17+00:00,0.0,0
MRK,Merck’s (MRK) Oncology Portfolio Gets Shot in the Arm with QLEX Nod,2025-09-26 15:09:52+00:00,0.0,0
MRK,"Merck & Co., Inc. (MRK) Received FDA Approval For Keytruda Qlex, Cutting Infusion Time to 2 Minutes",2025-09-23 23:02:38+00:00,0.9999902248382568,0
MRK,"FDA Grants Breakthrough Therapy Designation to Merck & Co., Inc. (MRK)’s Raludotatug Deruxtecan for Platinum-Resistant Ovarian",2025-09-22 21:32:10+00:00,0.0,0
MRK,"Merck & Co., Inc. (MRK) Launches $3B Plan to Reinvest Ahead of Keytruda Patent Expiry in 2028",2025-09-02 07:27:23+00:00,0.0,0
MRK,Merck (MRK) Impresses with New Cholesterol Drug in CORALreef Trial,2025-09-05 15:05:29+00:00,-0.9470036029815674,0
MRK,Analyst Highlights Growth Catalysts for Merck (MRK) Stock,2025-09-26 12:11:39+00:00,0.9999998807907104,0
MRK,Where is Merck & Co. (MRK) Headed According to Analysts?,2025-09-16 18:58:21+00:00,0.0,0
MRK,"Merck & Co., Inc. (MRK) Reports Positive Topline Results from its Phase 3 CORALreef Lipids Trial",2025-09-12 14:57:23+00:00,1.0,0
MRK,Resilience in Healthcare: How Merck (MRK) Maintains Consistent Dividends Through Market Uncertainty,2025-09-16 14:01:46+00:00,0.9998884201049805,0
MRK,"Merck & Co., Inc. (MRK) Advances Oncology Pipeline with Breakthrough FDA Designation for Ovarian Cancer Drug",2025-09-28 22:42:48+00:00,0.9998544454574585,0
MRK,Leerink Partners Maintained a Buy on Merck & Co (MRK),2025-09-07 14:48:07+00:00,0.9995077848434448,0
MRK,"Gradient Investments LLC Boosts Holdings in Merck & Co., Inc. $MRK",2025-09-17 08:12:46+00:00,0.9980295300483704,0
MRK,How The 30 Famous Firms In The Dow Do—Or Don’t—Create Value,2025-09-15 03:32:41+00:00,0.0,0
MRK,"3,055 Shares in Merck & Co., Inc. $MRK Purchased by Balefire LLC",2025-09-19 08:07:02+00:00,0.0,0
MRK,Merck’s (MRK) Oncology Portfolio Gets Shot in the Arm with QLEX Nod,2025-09-26 15:24:01+00:00,0.0,0
MRK,"Berenberg Bank Downgrades Merck & Co., Inc. (NYSE:MRK) to Hold",2025-09-18 07:00:52+00:00,-0.9492428302764893,0
MRK,Variational AI inks drug discovery deal with Merck worth up to $349-million,2025-09-23 11:05:36+00:00,0.0,0
MRK,"Merck & Co., Inc. (MRK) Advances Oncology Pipeline with Breakthrough FDA Designation for Ovarian Cancer Drug",2025-09-28 22:59:49+00:00,0.9998544454574585,0
MRK,"Sovran Advisors LLC Raises Stock Position in Merck & Co., Inc. $MRK",2025-09-21 07:50:49+00:00,0.0,0
MRK,"Merck & Co., Inc. (MRK) Reports Positive Topline Results from its Phase 3 CORALreef Lipids Trial",2025-09-12 15:20:34+00:00,1.0,0
MRK,"Wedge Capital Management L L P NC Purchases 272 Shares of Merck & Co., Inc. $MRK",2025-09-24 08:22:54+00:00,0.0,0
MRK,"First Hawaiian Bank Sells 10,434 Shares of Merck & Co., Inc. $MRK",2025-09-15 08:08:51+00:00,0.0,0
MRK,"Merck & Co., Inc. (NYSE:MRK) Receives $107.44 Consensus Target Price from Brokerages",2025-09-04 06:40:59+00:00,0.0,0
MRK,Marks Electrical Group (LON:MRK) Price Target Lowered to GBX 51 at Canaccord Genuity Group,2025-09-27 05:46:49+00:00,-0.9999736547470093,0
MRK,TN forms panel to probe alleged gas leak at Cuddalore SIPCOT unit,2025-09-06 06:37:23+00:00,0.0,0
MRK,Pharmaceutical Stocks To Keep An Eye On – August 30th,2025-09-01 06:04:44+00:00,0.0,0
MRK,Shareholders of Verona Pharma Approve Proposed Acquisition by Merck,2025-09-24 20:05:00+00:00,0.0,0
MRK,The Science Adventures of Tom and Huck (2025),2025-09-07 08:07:54+00:00,0.0,0
MRK,The Science Adventures of Tom and Huck (2025),2025-09-07 08:07:54+00:00,0.0,0
MRK,The Science Adventures of Tom and Huck (2025),2025-09-07 08:07:54+00:00,0.0,0
MRK,The Downfall of the German Dictatorship (2025),2025-09-14 06:42:19+00:00,-0.7803676128387451,0
MRK,Three Kilometres to the End of the World (2024),2025-09-24 04:04:14+00:00,0.0,0
MRK,The complete FC 26 chemistry styles list explained,2025-09-24 20:46:03+00:00,0.0,0
MRK,How Klebsiella pneumoniae controls its virulence,2025-09-15 14:00:00+00:00,0.0,0
WFC,Wells Fargo & Company (WFC) Partners With InvestCloud,2025-09-07 14:23:56+00:00,0.0,0
WFC,Wells Fargo & Co (WFC) Unveils New Note Program to Optimize Financial Operations,2025-09-02 04:46:04+00:00,0.8875752687454224,0
WFC,Here’s What Lifted Wells Fargo (WFC) in the First Half of 2025,2025-09-24 12:13:59+00:00,0.0,0
WFC,Piper Sandler Reaffirms Overweight on Wells Fargo (WFC) over Strong Underwriting and Growth Prospects,2025-09-24 12:46:06+00:00,1.0,0
WFC,How Wells Fargo & Company (WFC) Stands Out Among the Best Bank Dividend Stocks to Buy,2025-09-28 01:38:05+00:00,1.0,0
WFC,Jim Cramer Says Wells Fargo “Is the Best Position to Go Higher”,2025-09-24 08:28:33+00:00,0.9999997615814209,0
WFC,Wall Street Bullish on Wells Fargo & Company (WFC),2025-09-11 16:49:03+00:00,0.9999983310699463,0
WFC,Jim Cramer on Wells Fargo: “It’s Going to go Higher”,2025-09-20 04:45:05+00:00,0.0,0
WFC,How Is Universal Health Services’ Stock Performance Compared to Other Healthcare Providers?,2025-09-24 11:05:16+00:00,0.0,0
WFC,How Is Wells Fargo's Stock Performance Compared to Other Bank Stocks?,2025-09-01 12:39:50+00:00,0.0,0
WFC,"Wells Fargo & Company (WFC)’s CEO Has “Done So Much Good,” Says Jim Cramer",2025-09-15 14:55:09+00:00,0.994602620601654,0
WFC,JPMorgan's Jamie Dimon Says Economy Is 'Weakening' as Execs Sound Off Ahead of Fed Meeting,2025-09-11 20:56:48+00:00,-0.999992847442627,0
WFC,What You Need To Know Ahead of Wells Fargo's Earnings Release,2025-09-26 06:04:11+00:00,0.0,0
WFC,"Wells Fargo says US consumer finances are strong, with good credit",2025-09-09 13:23:27+00:00,1.0,0
WFC,“I want to keep learning and this is the perfect place to do that” – Alessia Russo on extending her stay at Arsenal,2025-09-06 09:20:00+00:00,0.0,0
WFC,Jim Cramer Calls Wells Fargo CEO “Terrific”,2025-09-13 13:45:15+00:00,0.0,0
WFC,"Chelsea FCW vs. Manchester City WFC, Women’s Super League: Preview, team news, how to watch",2025-09-05 07:07:54+00:00,0.0,0
WFC,"Aston Villa WFC 1-3 Chelsea FCW, Women’s Super League: Post-match reaction",2025-09-14 13:00:30+00:00,0.0,0
WFC,"Chelsea FCW vs. Leicester City WFC, Women’s Super League: Confirmed lineups; how to watch",2025-09-21 10:10:00+00:00,0.0,0
WFC,"West Ham WFC 0-4 Chelsea FCW, Women’s Super League: Post-match reaction",2025-09-28 15:27:20+00:00,0.0,0
WFC,Here's How Much $1000 Invested In Wells Fargo 5 Years Ago Would Be Worth Today,2025-09-04 16:58:21+00:00,0.0,0
WFC,"Chelsea FCW 1-0 Leicester City WFC, Women’s Super League: Post-match reaction",2025-09-21 12:58:10+00:00,0.0,0
WFC,"Aston Villa WFC vs. Chelsea FCW, Women’s Super League: Preview, team news, how to watch",2025-09-14 07:28:40+00:00,0.0,0
WFC,"Aston Villa WFC vs. Chelsea FCW, Women’s Super League: Confirmed lineups; how to watch",2025-09-14 10:08:38+00:00,0.0,0
WFC,"Chelsea FCW vs. Leicester City WFC, Women’s Super League: Preview, team news, how to watch",2025-09-21 05:06:06+00:00,0.0,0
WFC,"West Ham WFC vs. Chelsea FCW, Women’s Super League: Preview, team news, how to watch",2025-09-28 08:10:08+00:00,0.0,0
WFC,Zelle owner Early Warning Systems exploring stablecoin for retail bank customers,2025-09-11 15:45:03+00:00,0.0,0
WFC,Jim Cramer Says If You Don’t Own Any Bank Stocks “You Can Buy Wells Fargo”,2025-09-20 06:43:24+00:00,0.0,0
WFC,Wells Fargo & Company (WFC) Partners With InvestCloud,2025-09-07 14:47:58+00:00,0.0,0
WFC,"Almaty to Host the WFC 2025, First-Ever Global CSD Forum in Central Asia",2025-09-23 01:00:00+00:00,0.0,0
WFC,How Is Citigroup’s Stock Performance Compared to Other Banking Stocks?,2025-09-08 12:43:03+00:00,0.0,0
WFC,AlphaQuest LLC Takes Position in Wells Fargo & Company $WFC,2025-09-01 08:22:56+00:00,0.0,0
WFC,Wall Street Bullish on Wells Fargo & Company (WFC),2025-09-11 17:07:30+00:00,0.9999983310699463,0
WFC,Wells Fargo & Company (NYSE:WFC) Lowered to Sell Rating by Wall Street Zen,2025-09-27 07:24:47+00:00,-0.9998977184295654,0
WFC,"If You Invested $1000 In Wells Fargo Stock 5 Years Ago, You Would Have This Much Today",2025-09-24 20:39:00+00:00,0.0,0
WFC,Piper Sandler Reaffirms Overweight on Wells Fargo (WFC) over Strong Underwriting and Growth Prospects,2025-09-24 13:02:02+00:00,1.0,0
WFC,"How to Score 1,000% Returns Without Really Trying",2025-09-07 17:12:11+00:00,0.0,0
WFC,"Recent Filing Shows That Sen. A. Mitchell Mcconnell, Jr. Bought Over $1K Worth of Wells Fargo Stock",2025-09-15 15:12:48+00:00,0.0,0
WFC,Here's How Much $100 Invested In Wells Fargo 5 Years Ago Would Be Worth Today,2025-09-19 20:25:53+00:00,0.0,0
WFC,JPMorgan Chase’s Profit Engine That Remains Undervalued,2025-09-10 13:57:41+00:00,0.9999998807907104,0
WFC,Wells Fargo & Company $WFC Shares Sold by Thurston Springer Miller Herd & Titak Inc.,2025-09-17 07:42:59+00:00,0.0,0
WFC,Here’s What Lifted Wells Fargo (WFC) in the First Half of 2025,2025-09-24 12:39:18+00:00,0.0,0
WFC,"Modern Wealth Management LLC Acquires 1,773 Shares of Wells Fargo & Company $WFC",2025-09-14 11:42:43+00:00,0.0,0
WFC,"Procyon Advisors LLC Sells 3,520 Shares of Wells Fargo & Company $WFC",2025-09-20 07:54:58+00:00,0.0,0
WFC,"Kera Capital Partners Inc. Takes $236,000 Position in Wells Fargo & Company $WFC",2025-09-15 08:32:49+00:00,0.0,0
WFC,"30,589 Shares in Wells Fargo & Company $WFC Acquired by Kingstone Capital Partners Texas LLC",2025-09-22 08:07:00+00:00,0.0,0
WFC,"Wells Fargo & Company (WFC)’s CEO Has “Done So Much Good,” Says Jim Cramer",2025-09-15 15:12:46+00:00,0.994602620601654,0
WFC,Zelle owner Early Warning Services exploring stablecoin for retail bank customers,2025-09-11 15:45:03+00:00,0.0,0
WFC,The 3 execs now in a 'horse race' to succeed Moynihan as BofA CEO,2025-09-15 15:04:53+00:00,0.0,0
WFC,Sir Elton John 'so proud' of Watford FC as new kit marks 50 years since he became chairman,2025-09-10 16:00:00+00:00,0.999934196472168,0
WFC,"This week in banking: Top execs sound upbeat on quarter, less certain on economy",2025-09-10 13:18:44+00:00,0.9999979734420776,0
WFC,Multi-club ownership group Mercury 13 acquires majority stake in Bristol City Women,2025-09-18 11:01:04+00:00,0.0,0
WFC,Best Bank Stocks Worth Watching – September 7th,2025-09-09 06:34:55+00:00,0.0,0
WFC,Real Estate Stocks To Watch Today – September 21st,2025-09-23 07:06:51+00:00,0.0,0
WFC,Wells Fargo & Company (NYSE:WFC) Receives $82.56 Consensus Target Price from Brokerages,2025-09-15 07:32:57+00:00,0.0,0
WFC,Promising Real Estate Stocks To Keep An Eye On – August 31st,2025-09-02 08:04:53+00:00,0.9999845027923584,0
WFC,Top Bank Stocks To Follow Now – September 21st,2025-09-23 05:07:00+00:00,0.0,0
WFC,Best Bank Stocks To Follow Now – September 20th,2025-09-23 07:06:57+00:00,0.0,0
WFC,Insurance Stocks To Research – September 21st,2025-09-23 07:44:55+00:00,0.0,0
WFC,Top Bank Stocks To Watch Now – September 26th,2025-09-28 05:10:56+00:00,0.0,0
WFC,Bank Stocks To Follow Now – September 11th,2025-09-13 05:02:49+00:00,0.0,0
WFC,Best Bank Stocks To Watch Today – September 8th,2025-09-10 05:15:02+00:00,0.0,0
WFC,Promising Bank Stocks To Keep An Eye On – September 9th,2025-09-12 07:04:59+00:00,0.9959916472434998,0
WFC,Insurance Stocks To Follow Today – August 29th,2025-08-31 08:18:50+00:00,0.0,0
WFC,Top Real Estate Stocks To Keep An Eye On – September 2nd,2025-09-04 08:32:53+00:00,0.0,0
WFC,Wells Fargo & Company (NYSE:WFC) Given New $88.00 Price Target at Truist Financial,2025-09-26 05:50:56+00:00,0.0,0
WFC,EB have it tough in maiden AFC Women's CL appearance,2025-09-11 11:29:55+00:00,-0.9975628852844238,0
WFC,Gordon Brothers Propels Commercial Equipment Finance with $1.5B Joint Venture,2025-09-04 13:00:00+00:00,0.0,0
WFC,Ballon d'Or winners 2025: complete list of all award recipients from Paris ceremony,2025-09-22 21:10:47+00:00,0.0,0
WFC,Sen. Mitch McConnell Buys Wells Fargo & Company (NYSE:WFC) Shares,2025-09-17 06:08:42+00:00,0.0,0
WFC,"US stock market futures rally cautiously today as investors brace for Fed's pivotal 25 basis-point rate cut today — Dow, S&P 500 and Nasdaq slip; here are today’s top stock gainers and losers",2025-09-17 11:25:24+00:00,0.9062299132347107,0
WFC,Over 250 Global Brands Converge at FLAsia 2025,2025-09-07 13:53:06+00:00,0.0,0
CSCO,Palo Alto Networks: Is PANW Stock The Best Bet In Cybersecurity?,2025-09-10 13:28:59+00:00,0.9987469911575317,0
CSCO,Cisco Systems Inc. (CSCO) Expands Secure AI Factory with the Nvidia Platform,2025-09-10 11:35:25+00:00,0.9823042154312134,0
CSCO,"BofA Reaffirms Buy on Cisco (CSCO), Citing Growth Catalysts and Inexpensive valuation",2025-09-26 15:09:56+00:00,1.0,0
CSCO,Dividend Paying Stocks With Consistency: What Sets Cisco Systems (CSCO) Apart,2025-09-21 03:07:03+00:00,0.0,0
CSCO,How Cisco Systems (CSCO) Supports Shareholder Returns Through Innovation and Networking Solutions,2025-09-29 01:48:12+00:00,0.9999977350234985,0
CSCO,AVGO Stock vs. NVDA & INTC,2025-09-16 13:39:10+00:00,0.0,0
CSCO,Phillips 66 (PSX) – Among the Best Natural Gas and Oil Dividend Stocks to Invest in,2025-09-24 02:10:05+00:00,0.9999808073043823,0
CSCO,Is Cisco Systems Stock Outperforming the S&P 500?,2025-09-01 05:56:10+00:00,0.9986273050308228,0
CSCO,Analysts Push Cisco's Target Price Higher - Shorting CSCO Puts Works Here,2025-09-21 13:30:02+00:00,0.9996592998504639,0
